20:18:10.112902 IP 192.168.77.77.51390 > server.clickmeeting.com.27724: UDP, length 947
20:18:10.117563 IP 192.168.77.77.55330 > server.clickmeeting.com.23486: UDP, length 893
20:18:10.117564 IP 192.168.77.77.51390 > server.clickmeeting.com.27724: UDP, length 907
20:18:10.128564 IP 192.168.77.77.51390 > server.clickmeeting.com.27724: UDP, length 138
20:18:10.134167 IP 192.168.77.77.55330 > server.clickmeeting.com.23486: UDP, length 309
20:18:10.134169 IP 192.168.77.77.51390 > server.clickmeeting.com.27724: UDP, length 907
20:18:10.139674 IP 192.168.77.77.55330 > server.clickmeeting.com.23486: UDP, length 894
20:18:10.139675 IP 192.168.77.77.51390 > server.clickmeeting.com.27724: UDP, length 907
20:18:10.150268 IP 192.168.77.77.51390 > server.clickmeeting.com.27724: UDP, length 1144
20:18:10.156050 IP 192.168.77.77.55330 > server.clickmeeting.com.23486: UDP, length 991
20:18:10.161408 IP 192.168.77.77.51390 > server.clickmeeting.com.27724: UDP, length 1145
20:18:10.177271 IP 192.168.77.77.51390 > server.clickmeeting.com.27724: UDP, length 86
20:18:10.177614 IP 192.168.77.77.51390 > server.clickmeeting.com.27724: UDP, length 967
20:18:10.180998 IP 192.168.77.77.55330 > server.clickmeeting.com.23486: UDP, length 70
20:18:10.188628 IP 192.168.77.77.55330 > server.clickmeeting.com.23486: UDP, length 772
20:18:10.188630 IP 192.168.77.77.51390 > server.clickmeeting.com.27724: UDP, length 138
20:18:10.188630 IP 192.168.77.77.51390 > server.clickmeeting.com.27724: UDP, length 967
20:18:10.194449 IP 192.168.77.77.55330 > server.clickmeeting.com.23486: UDP, length 282
20:18:10.199946 IP 192.168.77.77.51390 > server.clickmeeting.com.27724: UDP, length 845
20:18:10.204943 IP 192.168.77.77.55330 > server.clickmeeting.com.23486: UDP, length 772
20:18:10.210814 IP 192.168.77.77.51390 > server.clickmeeting.com.27724: UDP, length 1154
20:18:10.221164 IP 192.168.77.77.55330 > server.clickmeeting.com.23486: UDP, length 515
20:18:10.221583 IP 192.168.77.77.51390 > server.clickmeeting.com.27724: UDP, length 1088
20:18:10.232675 IP 192.168.77.77.51390 > server.clickmeeting.com.27724: UDP, length 1088
20:18:10.233493 IP server.clickmeeting.com.23486 > 192.168.77.77.55330: UDP, length 46
20:18:10.233524 IP server.clickmeeting.com.23486 > 192.168.77.77.55330: UDP, length 46
20:18:10.233525 IP server.clickmeeting.com.27724 > 192.168.77.77.51390: UDP, length 46
20:18:10.233525 IP server.clickmeeting.com.27724 > 192.168.77.77.51390: UDP, length 46
20:18:10.243555 IP 192.168.77.77.51390 > server.clickmeeting.com.27724: UDP, length 1088
20:18:10.248917 IP 192.168.77.77.51390 > server.clickmeeting.com.27724: UDP, length 138
20:18:10.253348 IP 192.168.77.77.55330 > server.clickmeeting.com.23486: UDP, length 254
20:18:10.259885 IP 192.168.77.77.51390 > server.clickmeeting.com.27724: UDP, length 1177
20:18:10.270804 IP 192.168.77.77.51390 > server.clickmeeting.com.27724: UDP, length 1178
20:18:10.271853 IP server.clickmeeting.com.23486 > 192.168.77.77.55330: UDP, length 50
20:18:10.282184 IP 192.168.77.77.51390 > server.clickmeeting.com.27724: UDP, length 1178
20:18:10.282317 IP 192.168.77.77.55330 > server.clickmeeting.com.23486: UDP, length 22
20:18:10.286196 IP 192.168.77.77.55330 > server.clickmeeting.com.23486: UDP, length 892
20:18:10.297670 IP 192.168.77.77.51390 > server.clickmeeting.com.27724: UDP, length 965
20:18:10.299820 IP server.clickmeeting.com.27724 > 192.168.77.77.51390: UDP, length 58
20:18:10.302656 IP 192.168.77.77.55330 > server.clickmeeting.com.23486: UDP, length 892
20:18:10.308627 IP 192.168.77.77.51390 > server.clickmeeting.com.27724: UDP, length 138
20:18:10.308628 IP 192.168.77.77.51390 > server.clickmeeting.com.27724: UDP, length 966
20:18:10.314259 IP 192.168.77.77.55330 > server.clickmeeting.com.23486: UDP, length 253
20:18:10.319391 IP 192.168.77.77.51390 > server.clickmeeting.com.27724: UDP, length 966
20:18:10.324786 IP 192.168.77.77.55330 > server.clickmeeting.com.23486: UDP, length 893
20:18:10.330475 IP 192.168.77.77.51390 > server.clickmeeting.com.27724: UDP, length 904
20:18:10.335845 IP 192.168.77.77.51390 > server.clickmeeting.com.27724: UDP, length 905
20:18:10.341401 IP 192.168.77.77.55330 > server.clickmeeting.com.23486: UDP, length 836
20:18:10.346805 IP 192.168.77.77.51390 > server.clickmeeting.com.27724: UDP, length 905
20:18:10.357531 IP 192.168.77.77.55330 > server.clickmeeting.com.23486: UDP, length 837
20:18:10.357583 IP 192.168.77.77.51390 > server.clickmeeting.com.27724: UDP, length 1070
20:18:10.368649 IP 192.168.77.77.51390 > server.clickmeeting.com.27724: UDP, length 138
20:18:10.373974 IP 192.168.77.77.55330 > server.clickmeeting.com.23486: UDP, length 260
20:18:10.373975 IP 192.168.77.77.51390 > server.clickmeeting.com.27724: UDP, length 1070
20:18:10.379427 IP 192.168.77.77.55330 > server.clickmeeting.com.23486: UDP, length 847
20:18:10.384890 IP 192.168.77.77.51390 > server.clickmeeting.com.27724: UDP, length 1070
20:18:10.396395 IP 192.168.77.77.55330 > server.clickmeeting.com.23486: UDP, length 848
20:18:10.396397 IP 192.168.77.77.51390 > server.clickmeeting.com.27724: UDP, length 1071
20:18:10.406920 IP 192.168.77.77.51390 > server.clickmeeting.com.27724: UDP, length 1202
20:18:10.412143 IP 192.168.77.77.55330 > server.clickmeeting.com.23486: UDP, length 468
20:18:10.417664 IP 192.168.77.77.51390 > server.clickmeeting.com.27724: UDP, length 1202
20:18:10.423029 IP 192.168.77.77.55330 > server.clickmeeting.com.23486: UDP, length 1146
20:18:10.428638 IP 192.168.77.77.51390 > server.clickmeeting.com.27724: UDP, length 138
20:18:10.434048 IP 192.168.77.77.55330 > server.clickmeeting.com.23486: UDP, length 272
20:18:10.434058 IP 192.168.77.77.51390 > server.clickmeeting.com.27724: UDP, length 1202
20:18:10.450419 IP 192.168.77.77.55330 > server.clickmeeting.com.23486: UDP, length 1147
20:18:10.450421 IP 192.168.77.77.51390 > server.clickmeeting.com.27724: UDP, length 1203
20:18:10.461352 IP 192.168.77.77.51390 > server.clickmeeting.com.27724: UDP, length 1203
20:18:10.472226 IP server.clickmeeting.com.23486 > 192.168.77.77.55330: UDP, length 50
20:18:10.477618 IP 192.168.77.77.51390 > server.clickmeeting.com.27724: UDP, length 1203
20:18:10.488575 IP 192.168.77.77.51390 > server.clickmeeting.com.27724: UDP, length 138
20:18:10.488577 IP 192.168.77.77.55330 > server.clickmeeting.com.23486: UDP, length 759
20:18:10.488577 IP 192.168.77.77.51390 > server.clickmeeting.com.27724: UDP, length 1203
20:18:10.494033 IP 192.168.77.77.55330 > server.clickmeeting.com.23486: UDP, length 310
20:18:10.500159 IP server.clickmeeting.com.27724 > 192.168.77.77.51390: UDP, length 58
20:18:10.504872 IP 192.168.77.77.51390 > server.clickmeeting.com.27724: UDP, length 1203
20:18:10.510336 IP 192.168.77.77.55330 > server.clickmeeting.com.23486: UDP, length 760
20:18:10.516655 IP 192.168.77.77.51390 > server.clickmeeting.com.27724: UDP, length 1203
20:18:10.521270 IP 192.168.77.77.55330 > server.clickmeeting.com.23486: UDP, length 781
20:18:10.532279 IP 192.168.77.77.51390 > server.clickmeeting.com.27724: UDP, length 1203
20:18:10.537828 IP 192.168.77.77.55330 > server.clickmeeting.com.23486: UDP, length 782
20:18:10.543064 IP 192.168.77.77.51390 > server.clickmeeting.com.27724: UDP, length 1203
20:18:10.548446 IP 192.168.77.77.51390 > server.clickmeeting.com.27724: UDP, length 138
20:18:10.554012 IP 192.168.77.77.55330 > server.clickmeeting.com.23486: UDP, length 276
20:18:10.559485 IP 192.168.77.77.55330 > server.clickmeeting.com.23486: UDP, length 879
20:18:10.559487 IP 192.168.77.77.51390 > server.clickmeeting.com.27724: UDP, length 1203
20:18:10.570417 IP 192.168.77.77.51390 > server.clickmeeting.com.27724: UDP, length 1203
20:18:10.575894 IP 192.168.77.77.55330 > server.clickmeeting.com.23486: UDP, length 879
20:18:10.585857 IP 192.168.77.77.55330 > server.clickmeeting.com.23486: UDP, length 22
20:18:10.586788 IP 192.168.77.77.51390 > server.clickmeeting.com.27724: UDP, length 1203
20:18:10.597716 IP 192.168.77.77.55330 > server.clickmeeting.com.23486: UDP, length 641
20:18:10.597717 IP 192.168.77.77.51390 > server.clickmeeting.com.27724: UDP, length 1203
20:18:10.599706 IP 192.168.77.77.1037 > 20.54.36.229.https: Flags [P.], seq 2352080923:2352080967, ack 3979817874, win 1024, length 44
20:18:10.608721 IP 192.168.77.77.55330 > server.clickmeeting.com.23486: UDP, length 641
20:18:10.608722 IP 192.168.77.77.51390 > server.clickmeeting.com.27724: UDP, length 138
20:18:10.613971 IP 192.168.77.77.55330 > server.clickmeeting.com.23486: UDP, length 276
20:18:10.614019 IP 192.168.77.77.51390 > server.clickmeeting.com.27724: UDP, length 1203
20:18:10.620466 IP 192.168.77.77.51390 > server.clickmeeting.com.27724: UDP, length 86
20:18:10.624901 IP 192.168.77.77.51390 > server.clickmeeting.com.27724: UDP, length 1203
20:18:10.641519 IP 192.168.77.77.51390 > server.clickmeeting.com.27724: UDP, length 1203
20:18:10.652306 IP 192.168.77.77.51390 > server.clickmeeting.com.27724: UDP, length 1203
20:18:10.657645 IP 192.168.77.77.55330 > server.clickmeeting.com.23486: UDP, length 887
20:18:10.662751 IP 20.54.36.229.https > 192.168.77.77.1037: Flags [P.], seq 1:176, ack 44, win 7972, length 175
20:18:10.663117 IP 192.168.77.77.51390 > server.clickmeeting.com.27724: UDP, length 1203
20:18:10.668600 IP 192.168.77.77.51390 > server.clickmeeting.com.27724: UDP, length 138
20:18:10.673067 IP server.clickmeeting.com.23486 > 192.168.77.77.55330: UDP, length 50
20:18:10.673938 IP 192.168.77.77.55330 > server.clickmeeting.com.23486: UDP, length 276
20:18:10.679581 IP 192.168.77.77.55330 > server.clickmeeting.com.23486: UDP, length 887
20:18:10.679618 IP 192.168.77.77.51390 > server.clickmeeting.com.27724: UDP, length 1203
20:18:10.685340 IP 192.168.77.77.51390 > server.clickmeeting.com.27724: UDP, length 22
20:18:10.690448 IP 192.168.77.77.51390 > server.clickmeeting.com.27724: UDP, length 1203
20:18:10.696011 IP 192.168.77.77.55330 > server.clickmeeting.com.23486: UDP, length 709
20:18:10.700284 IP server.clickmeeting.com.27724 > 192.168.77.77.51390: UDP, length 54
20:18:10.706441 IP 192.168.77.77.1037 > 20.54.36.229.https: Flags [.], ack 176, win 1023, length 0
20:18:10.706723 IP 192.168.77.77.55330 > server.clickmeeting.com.23486: UDP, length 709
20:18:10.706805 IP 192.168.77.77.51390 > server.clickmeeting.com.27724: UDP, length 1203
20:18:10.717743 IP 192.168.77.77.51390 > server.clickmeeting.com.27724: UDP, length 945
20:18:10.723114 IP 192.168.77.77.55330 > server.clickmeeting.com.23486: UDP, length 855
20:18:10.728727 IP 192.168.77.77.51390 > server.clickmeeting.com.27724: UDP, length 138
20:18:10.728729 IP 192.168.77.77.51390 > server.clickmeeting.com.27724: UDP, length 945
20:18:10.734146 IP 192.168.77.77.55330 > server.clickmeeting.com.23486: UDP, length 276
20:18:10.739722 IP 192.168.77.77.51390 > server.clickmeeting.com.27724: UDP, length 946
20:18:10.744960 IP 192.168.77.77.55330 > server.clickmeeting.com.23486: UDP, length 856
20:18:10.750372 IP 192.168.77.77.51390 > server.clickmeeting.com.27724: UDP, length 946
20:18:10.762024 IP 192.168.77.77.51390 > server.clickmeeting.com.27724: UDP, length 1191
20:18:10.762027 IP 192.168.77.77.55330 > server.clickmeeting.com.23486: UDP, length 973
20:18:10.777705 IP 192.168.77.77.51390 > server.clickmeeting.com.27724: UDP, length 1192
20:18:10.783051 IP 192.168.77.77.55330 > server.clickmeeting.com.23486: UDP, length 974
20:18:10.788662 IP 192.168.77.77.51390 > server.clickmeeting.com.27724: UDP, length 138
20:18:10.788664 IP 192.168.77.77.51390 > server.clickmeeting.com.27724: UDP, length 1192
20:18:10.794389 IP 192.168.77.77.55330 > server.clickmeeting.com.23486: UDP, length 276
20:18:10.804991 IP 192.168.77.77.51390 > server.clickmeeting.com.27724: UDP, length 1192
20:18:10.815832 IP 192.168.77.77.51390 > server.clickmeeting.com.27724: UDP, length 1192
20:18:10.826993 IP 192.168.77.77.55330 > server.clickmeeting.com.23486: UDP, length 885
20:18:10.832371 IP 192.168.77.77.51390 > server.clickmeeting.com.27724: UDP, length 1192
20:18:10.843353 IP 192.168.77.77.51390 > server.clickmeeting.com.27724: UDP, length 1124
20:18:10.843355 IP 192.168.77.77.55330 > server.clickmeeting.com.23486: UDP, length 885
20:18:10.848595 IP 192.168.77.77.51390 > server.clickmeeting.com.27724: UDP, length 138
20:18:10.854109 IP 192.168.77.77.55330 > server.clickmeeting.com.23486: UDP, length 276
20:18:10.859639 IP 192.168.77.77.51390 > server.clickmeeting.com.27724: UDP, length 1124
20:18:10.865082 IP 192.168.77.77.55330 > server.clickmeeting.com.23486: UDP, length 1200
20:18:10.870499 IP 192.168.77.77.51390 > server.clickmeeting.com.27724: UDP, length 1125
20:18:10.873786 IP server.clickmeeting.com.23486 > 192.168.77.77.55330: UDP, length 50
20:18:10.881326 IP 192.168.77.77.51390 > server.clickmeeting.com.27724: UDP, length 1125
20:18:10.892334 IP 192.168.77.77.55330 > server.clickmeeting.com.23486: UDP, length 827
20:18:10.892336 IP 192.168.77.77.51390 > server.clickmeeting.com.27724: UDP, length 1125
20:18:10.900607 IP server.clickmeeting.com.27724 > 192.168.77.77.51390: UDP, length 58
20:18:10.908755 IP 192.168.77.77.55330 > server.clickmeeting.com.23486: UDP, length 827
20:18:10.908842 IP 192.168.77.77.51390 > server.clickmeeting.com.27724: UDP, length 138
20:18:10.908843 IP 192.168.77.77.51390 > server.clickmeeting.com.27724: UDP, length 1125
20:18:10.914086 IP 192.168.77.77.55330 > server.clickmeeting.com.23486: UDP, length 276
20:18:10.919497 IP 192.168.77.77.51390 > server.clickmeeting.com.27724: UDP, length 1136
20:18:10.930676 IP 192.168.77.77.55330 > server.clickmeeting.com.23486: UDP, length 781
20:18:10.930677 IP 192.168.77.77.51390 > server.clickmeeting.com.27724: UDP, length 1009
20:18:10.941446 IP 192.168.77.77.51390 > server.clickmeeting.com.27724: UDP, length 1009
20:18:10.946778 IP 192.168.77.77.55330 > server.clickmeeting.com.23486: UDP, length 781
20:18:10.952256 IP 192.168.77.77.51390 > server.clickmeeting.com.27724: UDP, length 1009
20:18:10.963321 IP 192.168.77.77.51390 > server.clickmeeting.com.27724: UDP, length 1010
20:18:10.968664 IP 192.168.77.77.51390 > server.clickmeeting.com.27724: UDP, length 138
20:18:10.974102 IP 192.168.77.77.55330 > server.clickmeeting.com.23486: UDP, length 276
20:18:10.979538 IP 192.168.77.77.51390 > server.clickmeeting.com.27724: UDP, length 190
20:18:10.979569 IP 192.168.77.77.51390 > server.clickmeeting.com.27724: UDP, length 1108
20:18:10.990582 IP 192.168.77.77.51390 > server.clickmeeting.com.27724: UDP, length 1108
20:18:10.996084 IP 192.168.77.77.55330 > server.clickmeeting.com.23486: UDP, length 970
20:18:11.004047 IP 192.168.77.77.51390 > server.clickmeeting.com.27724: UDP, length 86
20:18:11.006941 IP 192.168.77.77.51390 > server.clickmeeting.com.27724: UDP, length 1108
20:18:11.012282 IP 192.168.77.77.55330 > server.clickmeeting.com.23486: UDP, length 970
20:18:11.017675 IP 192.168.77.77.51390 > server.clickmeeting.com.27724: UDP, length 1108
20:18:11.028770 IP 192.168.77.77.51390 > server.clickmeeting.com.27724: UDP, length 138
20:18:11.028771 IP 192.168.77.77.51390 > server.clickmeeting.com.27724: UDP, length 1109
20:18:11.034230 IP 192.168.77.77.55330 > server.clickmeeting.com.23486: UDP, length 280
20:18:11.039739 IP 192.168.77.77.55330 > server.clickmeeting.com.23486: UDP, length 531
20:18:11.045036 IP 192.168.77.77.51390 > server.clickmeeting.com.27724: UDP, length 1109
20:18:11.056478 IP 192.168.77.77.51390 > server.clickmeeting.com.27724: UDP, length 1138
20:18:11.062095 IP 192.168.77.77.55330 > server.clickmeeting.com.23486: UDP, length 1066
20:18:11.067386 IP 192.168.77.77.51390 > server.clickmeeting.com.27724: UDP, length 1138
20:18:11.074181 IP server.clickmeeting.com.23486 > 192.168.77.77.55330: UDP, length 50
20:18:11.077756 IP 192.168.77.77.55330 > server.clickmeeting.com.23486: UDP, length 1067
20:18:11.078188 IP 192.168.77.77.51390 > server.clickmeeting.com.27724: UDP, length 1139
20:18:11.090158 IP 192.168.77.77.51390 > server.clickmeeting.com.27724: UDP, length 138
20:18:11.094412 IP 192.168.77.77.55330 > server.clickmeeting.com.23486: UDP, length 276
20:18:11.095597 IP 192.168.77.77.51390 > server.clickmeeting.com.27724: UDP, length 1139
20:18:11.100897 IP server.clickmeeting.com.27724 > 192.168.77.77.51390: UDP, length 58
20:18:11.105047 IP 192.168.77.77.55330 > server.clickmeeting.com.23486: UDP, length 783
20:18:11.105987 IP 192.168.77.77.51390 > server.clickmeeting.com.27724: UDP, length 1139
20:18:11.111097 IP ubuntu20-04.59531 > router.lan.domain: 12551+ PTR? 3.161.60.139.in-addr.arpa. (43)
20:18:11.116883 IP 192.168.77.77.51390 > server.clickmeeting.com.27724: UDP, length 1124
20:18:11.121343 IP 192.168.77.77.55330 > server.clickmeeting.com.23486: UDP, length 783
20:18:11.133507 IP 192.168.77.77.51390 > server.clickmeeting.com.27724: UDP, length 1124
20:18:11.137806 IP 192.168.77.77.55330 > server.clickmeeting.com.23486: UDP, length 926
20:18:11.144256 IP 192.168.77.77.51390 > server.clickmeeting.com.27724: UDP, length 1124
20:18:11.149643 IP 192.168.77.77.51390 > server.clickmeeting.com.27724: UDP, length 138
20:18:11.154071 IP 192.168.77.77.55330 > server.clickmeeting.com.23486: UDP, length 276
20:18:11.155016 IP 192.168.77.77.51390 > server.clickmeeting.com.27724: UDP, length 1124
20:18:11.165150 IP 192.168.77.77.55330 > server.clickmeeting.com.23486: UDP, length 927
20:18:11.171564 IP 192.168.77.77.51390 > server.clickmeeting.com.27724: UDP, length 1124
20:18:11.182400 IP 192.168.77.77.51390 > server.clickmeeting.com.27724: UDP, length 1124
20:18:11.193756 IP 192.168.77.77.51390 > server.clickmeeting.com.27724: UDP, length 1124
20:18:11.197777 STP 802.1w, Rapid STP, Flags [Learn, Forward], bridge-id 8000.48:8f:5a:98:f5:bc.8003, length 43
20:18:11.198799 IP 192.168.77.77.55330 > server.clickmeeting.com.23486: UDP, length 717
20:18:11.204291 IP 192.168.77.77.51390 > server.clickmeeting.com.27724: UDP, length 989
20:18:11.209762 IP 192.168.77.77.51390 > server.clickmeeting.com.27724: UDP, length 138
20:18:11.209763 IP 192.168.77.77.55330 > server.clickmeeting.com.23486: UDP, length 717
20:18:11.215172 IP 192.168.77.77.55330 > server.clickmeeting.com.23486: UDP, length 276
20:18:11.217522 IP 192.168.77.77.51390 > server.clickmeeting.com.27724: UDP, length 22
20:18:11.220552 IP 192.168.77.77.51390 > server.clickmeeting.com.27724: UDP, length 989
20:18:11.231738 IP 192.168.77.77.51390 > server.clickmeeting.com.27724: UDP, length 989
20:18:11.231740 IP 192.168.77.77.55330 > server.clickmeeting.com.23486: UDP, length 833
20:18:11.234090 IP server.clickmeeting.com.23486 > 192.168.77.77.55330: UDP, length 46
20:18:11.234092 IP server.clickmeeting.com.23486 > 192.168.77.77.55330: UDP, length 46
20:18:11.234092 IP server.clickmeeting.com.27724 > 192.168.77.77.51390: UDP, length 46
20:18:11.234092 IP server.clickmeeting.com.27724 > 192.168.77.77.51390: UDP, length 46
20:18:11.242755 IP 192.168.77.77.51390 > server.clickmeeting.com.27724: UDP, length 989
20:18:11.247922 IP 192.168.77.77.55330 > server.clickmeeting.com.23486: UDP, length 833
20:18:11.253290 IP 192.168.77.77.51390 > server.clickmeeting.com.27724: UDP, length 1148
20:18:11.264298 IP 192.168.77.77.51390 > server.clickmeeting.com.27724: UDP, length 1148
20:18:11.264677 IP 192.168.77.77.55330 > server.clickmeeting.com.23486: UDP, length 876
20:18:11.269775 IP 192.168.77.77.51390 > server.clickmeeting.com.27724: UDP, length 138
20:18:11.274229 IP server.clickmeeting.com.23486 > 192.168.77.77.55330: UDP, length 50
20:18:11.275685 IP 192.168.77.77.55330 > server.clickmeeting.com.23486: UDP, length 351
20:18:11.280563 IP 192.168.77.77.51390 > server.clickmeeting.com.27724: UDP, length 1101
20:18:11.286661 IP 192.168.77.77.55330 > server.clickmeeting.com.23486: UDP, length 877
20:18:11.296755 IP 192.168.77.77.51390 > server.clickmeeting.com.27724: UDP, length 648
20:18:11.299318 IP 192.168.77.77.51390 > server.clickmeeting.com.27724: UDP, length 648
20:18:11.302069 IP server.clickmeeting.com.27724 > 192.168.77.77.51390: UDP, length 54
20:18:11.303010 IP 192.168.77.77.55330 > server.clickmeeting.com.23486: UDP, length 870
20:18:11.304476 IP 192.168.77.77.51390 > server.clickmeeting.com.27724: UDP, length 788
20:18:11.309902 IP 192.168.77.77.51390 > server.clickmeeting.com.27724: UDP, length 788
20:18:11.319324 IP 192.168.77.77.55330 > server.clickmeeting.com.23486: UDP, length 870
20:18:11.320714 IP 192.168.77.77.51390 > server.clickmeeting.com.27724: UDP, length 770
20:18:11.327632 IP 192.168.77.77.51390 > server.clickmeeting.com.27724: UDP, length 1166
20:18:11.332346 IP 192.168.77.77.51390 > server.clickmeeting.com.27724: UDP, length 138
20:18:11.335757 IP 192.168.77.77.55330 > server.clickmeeting.com.23486: UDP, length 285
20:18:11.343376 IP 192.168.77.77.51390 > server.clickmeeting.com.27724: UDP, length 964
20:18:11.354036 IP 192.168.77.77.51390 > server.clickmeeting.com.27724: UDP, length 965
20:18:11.360241 IP 192.168.77.77.51390 > server.clickmeeting.com.27724: UDP, length 887
20:18:11.368559 IP 192.168.77.77.55330 > server.clickmeeting.com.23486: UDP, length 934
20:18:11.371941 IP 192.168.77.77.51390 > server.clickmeeting.com.27724: UDP, length 888
20:18:11.384760 IP 192.168.77.77.55330 > server.clickmeeting.com.23486: UDP, length 935
20:18:11.388290 IP 192.168.77.77.51390 > server.clickmeeting.com.27724: UDP, length 138
20:18:11.396516 IP 192.168.77.77.55330 > server.clickmeeting.com.23486: UDP, length 276
20:18:11.404697 IP 192.168.77.77.51390 > server.clickmeeting.com.27724: UDP, length 848
20:18:11.407281 IP 192.168.77.77.55330 > server.clickmeeting.com.23486: UDP, length 426
20:18:11.410090 IP 192.168.77.77.51390 > server.clickmeeting.com.27724: UDP, length 848
20:18:11.420966 IP 192.168.77.77.51390 > server.clickmeeting.com.27724: UDP, length 848
20:18:11.434573 IP 192.168.77.77.55330 > server.clickmeeting.com.23486: UDP, length 1090
20:18:11.448777 IP 192.168.77.77.51390 > server.clickmeeting.com.27724: UDP, length 138
20:18:11.453858 IP 192.168.77.77.51390 > server.clickmeeting.com.27724: UDP, length 973
20:18:11.456213 IP 192.168.77.77.55330 > server.clickmeeting.com.23486: UDP, length 276
20:18:11.459189 IP 192.168.77.77.51390 > server.clickmeeting.com.27724: UDP, length 974
20:18:11.461954 IP 192.168.77.77.55330 > server.clickmeeting.com.23486: UDP, length 1091
20:18:11.474799 IP server.clickmeeting.com.23486 > 192.168.77.77.55330: UDP, length 50
20:18:11.477563 IP 192.168.77.77.55330 > server.clickmeeting.com.23486: UDP, length 795
20:18:11.494842 IP 192.168.77.77.55330 > server.clickmeeting.com.23486: UDP, length 796
20:18:11.501966 IP server.clickmeeting.com.27724 > 192.168.77.77.51390: UDP, length 58
20:18:11.502882 IP 192.168.77.77.51390 > server.clickmeeting.com.27724: UDP, length 799
20:18:11.508407 IP 192.168.77.77.51390 > server.clickmeeting.com.27724: UDP, length 138
20:18:11.508408 IP 192.168.77.77.51390 > server.clickmeeting.com.27724: UDP, length 799
20:18:11.515213 IP 192.168.77.77.55330 > server.clickmeeting.com.23486: UDP, length 276
20:18:11.534337 IP 192.168.77.77.55330 > server.clickmeeting.com.23486: UDP, length 70
20:18:11.538151 IP 192.168.77.77.55330 > server.clickmeeting.com.23486: UDP, length 976
20:18:11.540564 IP 192.168.77.77.51390 > server.clickmeeting.com.27724: UDP, length 70
20:18:11.546017 IP 192.168.77.77.51390 > server.clickmeeting.com.27724: UDP, length 100
20:18:11.551926 IP 192.168.77.77.51390 > server.clickmeeting.com.27724: UDP, length 1097
20:18:11.554349 IP 192.168.77.77.55330 > server.clickmeeting.com.23486: UDP, length 976
20:18:11.568382 IP 192.168.77.77.51390 > server.clickmeeting.com.27724: UDP, length 138
20:18:11.570829 IP 192.168.77.77.55330 > server.clickmeeting.com.23486: UDP, length 363
20:18:11.576366 IP 192.168.77.77.55330 > server.clickmeeting.com.23486: UDP, length 260
20:18:11.603679 IP 192.168.77.77.55330 > server.clickmeeting.com.23486: UDP, length 833
20:18:11.606700 IP 192.168.77.77.51390 > server.clickmeeting.com.27724: UDP, length 860
20:18:11.612102 IP 192.168.77.77.51390 > server.clickmeeting.com.27724: UDP, length 860
20:18:11.614368 IP 192.168.77.77.55330 > server.clickmeeting.com.23486: UDP, length 834
20:18:11.622871 IP 192.168.77.77.51390 > server.clickmeeting.com.27724: UDP, length 861
20:18:11.628461 IP 192.168.77.77.51390 > server.clickmeeting.com.27724: UDP, length 138
20:18:11.631225 IP 192.168.77.77.55330 > server.clickmeeting.com.23486: UDP, length 834
20:18:11.636599 IP 192.168.77.77.55330 > server.clickmeeting.com.23486: UDP, length 296
20:18:11.652611 IP 192.168.77.77.55330 > server.clickmeeting.com.23486: UDP, length 920
20:18:11.655489 IP 192.168.77.77.51390 > server.clickmeeting.com.27724: UDP, length 1140
20:18:11.666095 IP server.clickmeeting.com.27724 > 192.168.77.77.51390: UDP, length 80
20:18:11.666725 IP 192.168.77.77.51390 > server.clickmeeting.com.27724: UDP, length 1140
20:18:11.674467 IP 192.168.77.77.55330 > server.clickmeeting.com.23486: UDP, length 920
20:18:11.675823 IP server.clickmeeting.com.23486 > 192.168.77.77.55330: UDP, length 50
20:18:11.677520 IP 192.168.77.77.51390 > server.clickmeeting.com.27724: UDP, length 1140
20:18:11.687806 IP 192.168.77.77.55330 > server.clickmeeting.com.23486: UDP, length 22
20:18:11.688232 IP 192.168.77.77.51390 > server.clickmeeting.com.27724: UDP, length 138
20:18:11.693786 IP 192.168.77.77.51390 > server.clickmeeting.com.27724: UDP, length 1141
20:18:11.697411 IP 192.168.77.77.55330 > server.clickmeeting.com.23486: UDP, length 276
20:18:11.703176 IP server.clickmeeting.com.27724 > 192.168.77.77.51390: UDP, length 50
20:18:11.703715 IP 192.168.77.77.51390 > server.clickmeeting.com.27724: UDP, length 70
20:18:11.708304 IP 192.168.77.77.55330 > server.clickmeeting.com.23486: UDP, length 825
20:18:11.710153 IP 192.168.77.77.51390 > server.clickmeeting.com.27724: UDP, length 808
20:18:11.715610 IP 192.168.77.77.51390 > server.clickmeeting.com.27724: UDP, length 808
20:18:11.724635 IP 192.168.77.77.55330 > server.clickmeeting.com.23486: UDP, length 825
20:18:11.732233 IP server.clickmeeting.com.27724 > 192.168.77.77.51390: UDP, length 46
20:18:11.740942 IP 192.168.77.77.55330 > server.clickmeeting.com.23486: UDP, length 804
20:18:11.750351 IP 192.168.77.77.51390 > server.clickmeeting.com.27724: UDP, length 138
20:18:11.751884 IP 192.168.77.77.55330 > server.clickmeeting.com.23486: UDP, length 804
20:18:11.753212 IP 192.168.77.77.51390 > server.clickmeeting.com.27724: UDP, length 22
20:18:11.755681 IP 192.168.77.77.51390 > server.clickmeeting.com.27724: UDP, length 1059
20:18:11.757182 IP 192.168.77.77.55330 > server.clickmeeting.com.23486: UDP, length 333
20:18:11.766914 IP 192.168.77.77.51390 > server.clickmeeting.com.27724: UDP, length 1060
20:18:11.779108 IP 192.168.77.77.55330 > server.clickmeeting.com.23486: UDP, length 811
20:18:11.795459 IP 192.168.77.77.55330 > server.clickmeeting.com.23486: UDP, length 812
20:18:11.807844 IP 192.168.77.77.55330 > server.clickmeeting.com.23486: UDP, length 493
20:18:11.810344 IP 192.168.77.77.51390 > server.clickmeeting.com.27724: UDP, length 138
20:18:11.810385 IP 192.168.77.77.51390 > server.clickmeeting.com.27724: UDP, length 921
20:18:11.813295 IP 192.168.77.77.55330 > server.clickmeeting.com.23486: UDP, length 311
20:18:11.821167 IP 192.168.77.77.51390 > server.clickmeeting.com.27724: UDP, length 921
20:18:11.832860 IP 192.168.77.77.51390 > server.clickmeeting.com.27724: UDP, length 921
20:18:11.840658 IP 192.168.77.77.55330 > server.clickmeeting.com.23486: UDP, length 822
20:18:11.856951 IP 192.168.77.77.55330 > server.clickmeeting.com.23486: UDP, length 823
20:18:11.859492 IP 192.168.77.77.51390 > server.clickmeeting.com.27724: UDP, length 884
20:18:11.866551 IP 192.168.77.77.51390 > server.clickmeeting.com.27724: UDP, length 884
20:18:11.870427 IP 192.168.77.77.51390 > server.clickmeeting.com.27724: UDP, length 138
20:18:11.873330 IP 192.168.77.77.55330 > server.clickmeeting.com.23486: UDP, length 306
20:18:11.875936 IP 192.168.77.77.51390 > server.clickmeeting.com.27724: UDP, length 885
20:18:11.876733 IP server.clickmeeting.com.23486 > 192.168.77.77.55330: UDP, length 50
20:18:11.878796 IP 192.168.77.77.55330 > server.clickmeeting.com.23486: UDP, length 823
20:18:11.903590 IP server.clickmeeting.com.27724 > 192.168.77.77.51390: UDP, length 50
20:18:11.906277 IP 192.168.77.77.55330 > server.clickmeeting.com.23486: UDP, length 997
20:18:11.914068 IP 192.168.77.77.51390 > server.clickmeeting.com.27724: UDP, length 1198
20:18:11.922423 IP 192.168.77.77.55330 > server.clickmeeting.com.23486: UDP, length 998
20:18:11.924954 IP 192.168.77.77.51390 > server.clickmeeting.com.27724: UDP, length 1198
20:18:11.930592 IP 192.168.77.77.51390 > server.clickmeeting.com.27724: UDP, length 138
20:18:11.939006 IP 192.168.77.77.55330 > server.clickmeeting.com.23486: UDP, length 299
20:18:11.949710 IP 192.168.77.77.55330 > server.clickmeeting.com.23486: UDP, length 683
20:18:11.957649 IP 192.168.77.77.51390 > server.clickmeeting.com.27724: UDP, length 864
20:18:11.960697 IP 192.168.77.77.55330 > server.clickmeeting.com.23486: UDP, length 683
20:18:11.963443 IP 192.168.77.77.55330 > server.clickmeeting.com.23486: UDP, length 100
20:18:11.963446 IP 192.168.77.77.51390 > server.clickmeeting.com.27724: UDP, length 865
20:18:11.977058 IP 192.168.77.77.55330 > server.clickmeeting.com.23486: UDP, length 615
20:18:11.990362 IP 192.168.77.77.51390 > server.clickmeeting.com.27724: UDP, length 138
20:18:11.993342 IP 192.168.77.77.55330 > server.clickmeeting.com.23486: UDP, length 291
20:18:12.011531 IP 192.168.77.77.55330 > server.clickmeeting.com.23486: UDP, length 878
20:18:12.017162 IP 192.168.77.77.51390 > server.clickmeeting.com.27724: UDP, length 893
20:18:12.022069 IP 192.168.77.77.55330 > server.clickmeeting.com.23486: UDP, length 878
20:18:12.022504 IP 192.168.77.77.51390 > server.clickmeeting.com.27724: UDP, length 893
20:18:12.044140 IP 192.168.77.77.55330 > server.clickmeeting.com.23486: UDP, length 879
20:18:12.049840 IP 192.168.77.77.51390 > server.clickmeeting.com.27724: UDP, length 138
20:18:12.054896 IP 192.168.77.77.55330 > server.clickmeeting.com.23486: UDP, length 276
20:18:12.060817 IP 192.168.77.77.51390 > server.clickmeeting.com.27724: UDP, length 1043
20:18:12.071988 IP 192.168.77.77.51390 > server.clickmeeting.com.27724: UDP, length 1044
20:18:12.076727 IP 192.168.77.77.55330 > server.clickmeeting.com.23486: UDP, length 827
20:18:12.077277 IP server.clickmeeting.com.23486 > 192.168.77.77.55330: UDP, length 50
20:18:12.083018 IP server.clickmeeting.com.23486 > 192.168.77.77.55330: UDP, length 80
20:18:12.093072 IP 192.168.77.77.55330 > server.clickmeeting.com.23486: UDP, length 827
20:18:12.104560 IP server.clickmeeting.com.27724 > 192.168.77.77.51390: UDP, length 50
20:18:12.109566 IP 192.168.77.77.55330 > server.clickmeeting.com.23486: UDP, length 827
20:18:12.109946 IP 192.168.77.77.51390 > server.clickmeeting.com.27724: UDP, length 138
20:18:12.109947 IP 192.168.77.77.51390 > server.clickmeeting.com.27724: UDP, length 826
20:18:12.114866 IP 192.168.77.77.55330 > server.clickmeeting.com.23486: UDP, length 274
20:18:12.120828 IP 192.168.77.77.51390 > server.clickmeeting.com.27724: UDP, length 826
20:18:12.131365 IP 192.168.77.77.55330 > server.clickmeeting.com.23486: UDP, length 878
20:18:12.147651 IP 192.168.77.77.55330 > server.clickmeeting.com.23486: UDP, length 879
20:18:12.159038 IP 192.168.77.77.51390 > server.clickmeeting.com.27724: UDP, length 1160
20:18:12.164205 IP 192.168.77.77.55330 > server.clickmeeting.com.23486: UDP, length 860
20:18:12.170420 IP 192.168.77.77.51390 > server.clickmeeting.com.27724: UDP, length 138
20:18:12.170422 IP 192.168.77.77.51390 > server.clickmeeting.com.27724: UDP, length 1161
20:18:12.175126 IP 192.168.77.77.55330 > server.clickmeeting.com.23486: UDP, length 273
20:18:12.191285 IP 192.168.77.77.55330 > server.clickmeeting.com.23486: UDP, length 861
20:18:12.207705 IP 192.168.77.77.55330 > server.clickmeeting.com.23486: UDP, length 888
20:18:12.214076 IP 192.168.77.77.51390 > server.clickmeeting.com.27724: UDP, length 781
20:18:12.219492 IP 192.168.77.77.51390 > server.clickmeeting.com.27724: UDP, length 781
20:18:12.223933 IP 192.168.77.77.55330 > server.clickmeeting.com.23486: UDP, length 889
20:18:12.230788 IP 192.168.77.77.51390 > server.clickmeeting.com.27724: UDP, length 138
20:18:12.232936 IP server.clickmeeting.com.23486 > 192.168.77.77.55330: UDP, length 46
20:18:12.232937 IP server.clickmeeting.com.23486 > 192.168.77.77.55330: UDP, length 46
20:18:12.233418 IP server.clickmeeting.com.27724 > 192.168.77.77.51390: UDP, length 46
20:18:12.233420 IP server.clickmeeting.com.27724 > 192.168.77.77.51390: UDP, length 46
20:18:12.235101 IP 192.168.77.77.55330 > server.clickmeeting.com.23486: UDP, length 273
20:18:12.245841 IP 192.168.77.77.55330 > server.clickmeeting.com.23486: UDP, length 817
20:18:12.262323 IP 192.168.77.77.55330 > server.clickmeeting.com.23486: UDP, length 818
20:18:12.263456 IP 192.168.77.77.51390 > server.clickmeeting.com.27724: UDP, length 1071
20:18:12.274140 IP 192.168.77.77.51390 > server.clickmeeting.com.27724: UDP, length 1072
20:18:12.277412 IP server.clickmeeting.com.23486 > 192.168.77.77.55330: UDP, length 50
20:18:12.278494 IP 192.168.77.77.55330 > server.clickmeeting.com.23486: UDP, length 707
20:18:12.285047 IP 192.168.77.77.51390 > server.clickmeeting.com.27724: UDP, length 1072
20:18:12.290395 IP 192.168.77.77.51390 > server.clickmeeting.com.27724: UDP, length 138
20:18:12.294970 IP 192.168.77.77.55330 > server.clickmeeting.com.23486: UDP, length 265
20:18:12.300450 IP 192.168.77.77.55330 > server.clickmeeting.com.23486: UDP, length 707
20:18:12.305204 IP server.clickmeeting.com.27724 > 192.168.77.77.51390: UDP, length 50
20:18:12.312322 IP 192.168.77.77.55330 > server.clickmeeting.com.23486: UDP, length 825
20:18:12.317146 IP 192.168.77.77.55330 > server.clickmeeting.com.23486: UDP, length 70
20:18:12.317633 IP 192.168.77.77.51390 > server.clickmeeting.com.27724: UDP, length 919
20:18:12.323111 IP 192.168.77.77.51390 > server.clickmeeting.com.27724: UDP, length 919
20:18:12.328847 IP 192.168.77.77.55330 > server.clickmeeting.com.23486: UDP, length 825
20:18:12.333640 IP router.lan.domain > ubuntu20-04.59531: 12551 1/0/0 PTR server.clickmeeting.com. (80)
20:18:12.334246 IP 192.168.77.77.51390 > server.clickmeeting.com.27724: UDP, length 919
20:18:12.334467 IP ubuntu20-04.35916 > router.lan.domain: 31850+ PTR? 77.77.168.192.in-addr.arpa. (44)
20:18:12.345055 IP 192.168.77.77.51390 > server.clickmeeting.com.27724: UDP, length 919
20:18:12.345065 IP 192.168.77.77.55330 > server.clickmeeting.com.23486: UDP, length 727
20:18:12.350418 IP 192.168.77.77.51390 > server.clickmeeting.com.27724: UDP, length 138
20:18:12.352127 IP router.lan.domain > ubuntu20-04.35916: 31850 NXDomain 0/0/0 (44)
20:18:12.352695 IP ubuntu20-04.58060 > router.lan.domain: 29720+ PTR? 229.36.54.20.in-addr.arpa. (43)
20:18:12.355880 IP 192.168.77.77.55330 > server.clickmeeting.com.23486: UDP, length 309
20:18:12.366911 IP 192.168.77.77.55330 > server.clickmeeting.com.23486: UDP, length 727
20:18:12.366925 IP 192.168.77.77.51390 > server.clickmeeting.com.27724: UDP, length 1050
20:18:12.372811 IP 192.168.77.77.51390 > server.clickmeeting.com.27724: UDP, length 1051
20:18:12.388658 IP 192.168.77.77.51390 > server.clickmeeting.com.27724: UDP, length 1051
20:18:12.399651 IP 192.168.77.77.51390 > server.clickmeeting.com.27724: UDP, length 1051
20:18:12.411152 IP 192.168.77.77.51390 > server.clickmeeting.com.27724: UDP, length 138
20:18:12.415937 IP 192.168.77.77.51390 > server.clickmeeting.com.27724: UDP, length 1199
20:18:12.416865 IP 192.168.77.77.55330 > server.clickmeeting.com.23486: UDP, length 252
20:18:12.416866 IP 192.168.77.77.55330 > server.clickmeeting.com.23486: UDP, length 639
20:18:12.426885 IP 192.168.77.77.51390 > server.clickmeeting.com.27724: UDP, length 1199
20:18:12.433375 IP 192.168.77.77.55330 > server.clickmeeting.com.23486: UDP, length 639
20:18:12.437902 IP 192.168.77.77.51390 > server.clickmeeting.com.27724: UDP, length 1199
20:18:12.449682 IP 192.168.77.77.55330 > server.clickmeeting.com.23486: UDP, length 1172
20:18:12.458551 IP router.lan.domain > ubuntu20-04.58060: 29720 NXDomain 0/1/0 (129)
20:18:12.459649 IP ubuntu20-04.59429 > router.lan.domain: 37835+ PTR? 1.77.168.192.in-addr.arpa. (43)
20:18:12.461192 IP router.lan.domain > ubuntu20-04.59429: 37835 1/0/1 PTR router.lan. (83)
20:18:12.463059 IP ubuntu20-04.36447 > router.lan.domain: 58202+ PTR? 69.77.168.192.in-addr.arpa. (44)
20:18:12.470729 IP 192.168.77.77.51390 > server.clickmeeting.com.27724: UDP, length 138
20:18:12.470730 IP 192.168.77.77.51390 > server.clickmeeting.com.27724: UDP, length 1154
20:18:12.476873 IP router.lan.domain > ubuntu20-04.36447: 58202 NXDomain 0/0/0 (44)
20:18:12.477008 IP 192.168.77.77.55330 > server.clickmeeting.com.23486: UDP, length 251
20:18:12.478043 IP server.clickmeeting.com.23486 > 192.168.77.77.55330: UDP, length 54
20:18:12.481459 IP 192.168.77.77.51390 > server.clickmeeting.com.27724: UDP, length 1155
20:18:12.482401 IP 192.168.77.77.55330 > server.clickmeeting.com.23486: UDP, length 1115
20:18:12.497961 IP 192.168.77.77.51390 > server.clickmeeting.com.27724: UDP, length 1155
20:18:12.506553 IP server.clickmeeting.com.27724 > 192.168.77.77.51390: UDP, length 50
20:18:12.515181 IP 192.168.77.77.55330 > server.clickmeeting.com.23486: UDP, length 834
20:18:12.519609 IP 192.168.77.77.51390 > server.clickmeeting.com.27724: UDP, length 1019
20:18:12.530851 IP 192.168.77.77.51390 > server.clickmeeting.com.27724: UDP, length 138
20:18:12.530853 IP 192.168.77.77.51390 > server.clickmeeting.com.27724: UDP, length 1020
20:18:12.531738 IP 192.168.77.77.55330 > server.clickmeeting.com.23486: UDP, length 835
20:18:12.531740 IP 192.168.77.77.55330 > server.clickmeeting.com.23486: UDP, length 70
20:18:12.534579 IP 192.168.77.77.51390 > server.clickmeeting.com.27724: UDP, length 86
20:18:12.537028 IP 192.168.77.77.55330 > server.clickmeeting.com.23486: UDP, length 313
20:18:12.553355 IP 192.168.77.77.55330 > server.clickmeeting.com.23486: UDP, length 836
20:18:12.569331 IP 192.168.77.77.51390 > server.clickmeeting.com.27724: UDP, length 1185
20:18:12.569659 IP 192.168.77.77.55330 > server.clickmeeting.com.23486: UDP, length 836
20:18:12.580165 IP 192.168.77.77.51390 > server.clickmeeting.com.27724: UDP, length 1185
20:18:12.591002 IP 192.168.77.77.51390 > server.clickmeeting.com.27724: UDP, length 138
20:18:12.596882 IP 192.168.77.77.51390 > server.clickmeeting.com.27724: UDP, length 1186
20:18:12.597041 IP 192.168.77.77.55330 > server.clickmeeting.com.23486: UDP, length 303
20:18:12.613421 IP 192.168.77.77.55330 > server.clickmeeting.com.23486: UDP, length 833
20:18:12.619801 IP 192.168.77.77.51390 > server.clickmeeting.com.27724: UDP, length 1017
20:18:12.629936 IP 192.168.77.77.55330 > server.clickmeeting.com.23486: UDP, length 834
20:18:12.630814 IP 192.168.77.77.51390 > server.clickmeeting.com.27724: UDP, length 1018
20:18:12.642864 IP 192.168.77.77.51390 > server.clickmeeting.com.27724: UDP, length 1018
20:18:12.646125 IP 192.168.77.77.55330 > server.clickmeeting.com.23486: UDP, length 843
20:18:12.647523 IP 192.168.77.77.51390 > server.clickmeeting.com.27724: UDP, length 138
20:18:12.657025 IP 192.168.77.77.55330 > server.clickmeeting.com.23486: UDP, length 303
20:18:12.668079 IP 192.168.77.77.55330 > server.clickmeeting.com.23486: UDP, length 844
20:18:12.669440 IP 192.168.77.77.51390 > server.clickmeeting.com.27724: UDP, length 1174
20:18:12.678931 IP server.clickmeeting.com.23486 > 192.168.77.77.55330: UDP, length 50
20:18:12.680787 IP 192.168.77.77.51390 > server.clickmeeting.com.27724: UDP, length 1174
20:18:12.684304 IP 192.168.77.77.55330 > server.clickmeeting.com.23486: UDP, length 867
20:18:12.691725 IP 192.168.77.77.51390 > server.clickmeeting.com.27724: UDP, length 1174
20:18:12.700838 IP 192.168.77.77.55330 > server.clickmeeting.com.23486: UDP, length 867
20:18:12.702700 IP 192.168.77.77.51390 > server.clickmeeting.com.27724: UDP, length 1174
20:18:12.706178 IP server.clickmeeting.com.27724 > 192.168.77.77.51390: UDP, length 54
20:18:12.709403 IP 192.168.77.77.51390 > server.clickmeeting.com.27724: UDP, length 138
20:18:12.716993 IP 192.168.77.77.55330 > server.clickmeeting.com.23486: UDP, length 279
20:18:12.718900 IP 192.168.77.77.51390 > server.clickmeeting.com.27724: UDP, length 1136
20:18:12.722438 IP 192.168.77.77.55330 > server.clickmeeting.com.23486: UDP, length 1023
20:18:12.730172 IP 192.168.77.77.51390 > server.clickmeeting.com.27724: UDP, length 1137
20:18:12.744328 IP 192.168.77.77.55330 > server.clickmeeting.com.23486: UDP, length 1024
20:18:12.746362 IP 192.168.77.77.51390 > server.clickmeeting.com.27724: UDP, length 1137
20:18:12.768271 IP 192.168.77.77.51390 > server.clickmeeting.com.27724: UDP, length 138
20:18:12.768274 IP 192.168.77.77.51390 > server.clickmeeting.com.27724: UDP, length 154
20:18:12.777126 IP 192.168.77.77.55330 > server.clickmeeting.com.23486: UDP, length 245
20:18:12.782549 IP 192.168.77.77.55330 > server.clickmeeting.com.23486: UDP, length 380
20:18:12.821195 IP 192.168.77.77.55330 > server.clickmeeting.com.23486: UDP, length 861
20:18:12.822612 IP 192.168.77.77.51390 > server.clickmeeting.com.27724: UDP, length 1148
20:18:12.828445 IP 192.168.77.77.51390 > server.clickmeeting.com.27724: UDP, length 138
20:18:12.833689 IP 192.168.77.77.51390 > server.clickmeeting.com.27724: UDP, length 1148
20:18:12.837600 IP 192.168.77.77.55330 > server.clickmeeting.com.23486: UDP, length 288
20:18:12.843204 IP 192.168.77.77.55330 > server.clickmeeting.com.23486: UDP, length 862
20:18:12.844854 IP 192.168.77.77.51390 > server.clickmeeting.com.27724: UDP, length 1148
20:18:12.859407 IP 192.168.77.77.55330 > server.clickmeeting.com.23486: UDP, length 862
20:18:12.860819 IP 192.168.77.77.51390 > server.clickmeeting.com.27724: UDP, length 1149
20:18:12.871817 IP 192.168.77.77.51390 > server.clickmeeting.com.27724: UDP, length 1149
20:18:12.875780 IP 192.168.77.77.55330 > server.clickmeeting.com.23486: UDP, length 1177
20:18:12.879612 IP server.clickmeeting.com.23486 > 192.168.77.77.55330: UDP, length 50
20:18:12.882674 IP 192.168.77.77.51390 > server.clickmeeting.com.27724: UDP, length 1149
20:18:12.888350 IP 192.168.77.77.51390 > server.clickmeeting.com.27724: UDP, length 138
20:18:12.897647 IP 192.168.77.77.55330 > server.clickmeeting.com.23486: UDP, length 299
20:18:12.899115 IP 192.168.77.77.51390 > server.clickmeeting.com.27724: UDP, length 1070
20:18:12.906681 IP server.clickmeeting.com.27724 > 192.168.77.77.51390: UDP, length 54
20:18:12.908557 IP 192.168.77.77.55330 > server.clickmeeting.com.23486: UDP, length 709
20:18:12.909966 IP 192.168.77.77.51390 > server.clickmeeting.com.27724: UDP, length 1070
20:18:12.919415 IP 192.168.77.77.55330 > server.clickmeeting.com.23486: UDP, length 710
20:18:12.920824 IP 192.168.77.77.51390 > server.clickmeeting.com.27724: UDP, length 1071
20:18:12.931994 IP 192.168.77.77.51390 > server.clickmeeting.com.27724: UDP, length 1071
20:18:12.948287 IP 192.168.77.77.51390 > server.clickmeeting.com.27724: UDP, length 138
20:18:12.948288 IP 192.168.77.77.51390 > server.clickmeeting.com.27724: UDP, length 1135
20:18:12.952109 IP 192.168.77.77.55330 > server.clickmeeting.com.23486: UDP, length 790
20:18:12.957498 IP 192.168.77.77.55330 > server.clickmeeting.com.23486: UDP, length 297
20:18:12.959058 IP 192.168.77.77.51390 > server.clickmeeting.com.27724: UDP, length 1136
20:18:12.973038 IP 192.168.77.77.55330 > server.clickmeeting.com.23486: UDP, length 22
20:18:12.974013 IP 192.168.77.77.55330 > server.clickmeeting.com.23486: UDP, length 790
20:18:12.975570 IP 192.168.77.77.51390 > server.clickmeeting.com.27724: UDP, length 1136
20:18:12.986492 IP 192.168.77.77.51390 > server.clickmeeting.com.27724: UDP, length 980
20:18:12.986492 IP 192.168.77.77.51390 > server.clickmeeting.com.27724: UDP, length 22
20:18:12.990248 IP 192.168.77.77.55330 > server.clickmeeting.com.23486: UDP, length 528
20:18:12.997365 IP 192.168.77.77.51390 > server.clickmeeting.com.27724: UDP, length 981
20:18:13.008349 IP 192.168.77.77.51390 > server.clickmeeting.com.27724: UDP, length 138
20:18:13.008350 IP 192.168.77.77.51390 > server.clickmeeting.com.27724: UDP, length 981
20:18:13.017604 IP 192.168.77.77.55330 > server.clickmeeting.com.23486: UDP, length 315
20:18:13.019000 IP 192.168.77.77.51390 > server.clickmeeting.com.27724: UDP, length 981
20:18:13.022952 IP 192.168.77.77.55330 > server.clickmeeting.com.23486: UDP, length 1188
20:18:13.030215 IP 192.168.77.77.51390 > server.clickmeeting.com.27724: UDP, length 1155
20:18:13.041000 IP 192.168.77.77.51390 > server.clickmeeting.com.27724: UDP, length 1155
20:18:13.044888 IP 192.168.77.77.55330 > server.clickmeeting.com.23486: UDP, length 1189
20:18:13.052141 IP 192.168.77.77.51390 > server.clickmeeting.com.27724: UDP, length 1156
20:18:13.066841 IP 192.168.77.77.55330 > server.clickmeeting.com.23486: UDP, length 768
20:18:13.068649 IP 192.168.77.77.51390 > server.clickmeeting.com.27724: UDP, length 138
20:18:13.073667 IP 192.168.77.77.51390 > server.clickmeeting.com.27724: UDP, length 1035
20:18:13.077653 IP 192.168.77.77.55330 > server.clickmeeting.com.23486: UDP, length 311
20:18:13.080272 IP server.clickmeeting.com.23486 > 192.168.77.77.55330: UDP, length 50
20:18:13.084556 IP 192.168.77.77.51390 > server.clickmeeting.com.27724: UDP, length 1036
20:18:13.094458 IP 192.168.77.77.55330 > server.clickmeeting.com.23486: UDP, length 768
20:18:13.106765 IP server.clickmeeting.com.27724 > 192.168.77.77.51390: UDP, length 54
20:18:13.121273 IP 192.168.77.77.55330 > server.clickmeeting.com.23486: UDP, length 1067
20:18:13.122679 IP 192.168.77.77.51390 > server.clickmeeting.com.27724: UDP, length 1017
20:18:13.128311 IP 192.168.77.77.51390 > server.clickmeeting.com.27724: UDP, length 138
20:18:13.133720 IP 192.168.77.77.51390 > server.clickmeeting.com.27724: UDP, length 1017
20:18:13.138208 IP 192.168.77.77.55330 > server.clickmeeting.com.23486: UDP, length 278
20:18:13.144619 IP 192.168.77.77.51390 > server.clickmeeting.com.27724: UDP, length 1017
20:18:13.148072 IP 192.168.77.77.55330 > server.clickmeeting.com.23486: UDP, length 1068
20:18:13.164497 IP 192.168.77.77.55330 > server.clickmeeting.com.23486: UDP, length 515
20:18:13.177443 IP 192.168.77.77.51390 > server.clickmeeting.com.27724: UDP, length 837
20:18:13.182777 IP 192.168.77.77.51390 > server.clickmeeting.com.27724: UDP, length 838
20:18:13.186382 IP 192.168.77.77.55330 > server.clickmeeting.com.23486: UDP, length 1137
20:18:13.188135 IP 192.168.77.77.51390 > server.clickmeeting.com.27724: UDP, length 138
20:18:13.193839 IP 192.168.77.77.51390 > server.clickmeeting.com.27724: UDP, length 838
20:18:13.197230 IP 192.168.77.77.55330 > server.clickmeeting.com.23486: UDP, length 233
20:18:13.199955 STP 802.1w, Rapid STP, Flags [Learn, Forward], bridge-id 8000.48:8f:5a:98:f5:bc.8003, length 43
20:18:13.213500 IP 192.168.77.77.55330 > server.clickmeeting.com.23486: UDP, length 1137
20:18:13.226701 IP 192.168.77.77.51390 > server.clickmeeting.com.27724: UDP, length 1095
20:18:13.234054 IP server.clickmeeting.com.27724 > 192.168.77.77.51390: UDP, length 46
20:18:13.234055 IP server.clickmeeting.com.27724 > 192.168.77.77.51390: UDP, length 46
20:18:13.234329 IP server.clickmeeting.com.23486 > 192.168.77.77.55330: UDP, length 46
20:18:13.234330 IP server.clickmeeting.com.23486 > 192.168.77.77.55330: UDP, length 46
20:18:13.235307 IP 192.168.77.77.55330 > server.clickmeeting.com.23486: UDP, length 709
20:18:13.237326 IP 192.168.77.77.51390 > server.clickmeeting.com.27724: UDP, length 1096
20:18:13.246419 IP 192.168.77.77.55330 > server.clickmeeting.com.23486: UDP, length 710
20:18:13.249081 IP 192.168.77.77.51390 > server.clickmeeting.com.27724: UDP, length 138
20:18:13.257137 IP 192.168.77.77.55330 > server.clickmeeting.com.23486: UDP, length 221
20:18:13.268142 IP 192.168.77.77.55330 > server.clickmeeting.com.23486: UDP, length 820
20:18:13.270578 IP 192.168.77.77.51390 > server.clickmeeting.com.27724: UDP, length 949
20:18:13.276135 IP 192.168.77.77.51390 > server.clickmeeting.com.27724: UDP, length 949
20:18:13.279925 IP server.clickmeeting.com.23486 > 192.168.77.77.55330: UDP, length 50
20:18:13.284439 IP 192.168.77.77.55330 > server.clickmeeting.com.23486: UDP, length 820
20:18:13.306829 IP server.clickmeeting.com.27724 > 192.168.77.77.51390: UDP, length 54
20:18:13.308793 IP 192.168.77.77.51390 > server.clickmeeting.com.27724: UDP, length 138
20:18:13.317014 IP 192.168.77.77.55330 > server.clickmeeting.com.23486: UDP, length 222
20:18:13.322190 IP 192.168.77.77.55330 > server.clickmeeting.com.23486: UDP, length 1054
20:18:13.325180 IP 192.168.77.77.51390 > server.clickmeeting.com.27724: UDP, length 842
20:18:13.330654 IP 192.168.77.77.51390 > server.clickmeeting.com.27724: UDP, length 842
20:18:13.338585 IP 192.168.77.77.55330 > server.clickmeeting.com.23486: UDP, length 1054
20:18:13.341703 IP 192.168.77.77.51390 > server.clickmeeting.com.27724: UDP, length 842
20:18:13.360595 IP 192.168.77.77.55330 > server.clickmeeting.com.23486: UDP, length 657
20:18:13.369093 IP 192.168.77.77.51390 > server.clickmeeting.com.27724: UDP, length 138
20:18:13.374259 IP 192.168.77.77.51390 > server.clickmeeting.com.27724: UDP, length 1178
20:18:13.377181 IP 192.168.77.77.55330 > server.clickmeeting.com.23486: UDP, length 236
20:18:13.385160 IP 192.168.77.77.51390 > server.clickmeeting.com.27724: UDP, length 1178
20:18:13.388138 IP 192.168.77.77.55330 > server.clickmeeting.com.23486: UDP, length 850
20:18:13.396265 IP 192.168.77.77.51390 > server.clickmeeting.com.27724: UDP, length 1178
20:18:13.404478 IP 192.168.77.77.55330 > server.clickmeeting.com.23486: UDP, length 851
20:18:13.412426 IP 192.168.77.77.51390 > server.clickmeeting.com.27724: UDP, length 1179
20:18:13.421035 IP 192.168.77.77.55330 > server.clickmeeting.com.23486: UDP, length 851
20:18:13.428969 IP 192.168.77.77.51390 > server.clickmeeting.com.27724: UDP, length 138
20:18:13.428971 IP 192.168.77.77.51390 > server.clickmeeting.com.27724: UDP, length 1147
20:18:13.437338 IP 192.168.77.77.55330 > server.clickmeeting.com.23486: UDP, length 237
20:18:13.439756 IP 192.168.77.77.51390 > server.clickmeeting.com.27724: UDP, length 1147
20:18:13.442708 IP 192.168.77.77.55330 > server.clickmeeting.com.23486: UDP, length 828
20:18:13.451914 IP 192.168.77.77.51390 > server.clickmeeting.com.27724: UDP, length 1148
20:18:13.459032 IP 192.168.77.77.55330 > server.clickmeeting.com.23486: UDP, length 828
20:18:13.467057 IP 192.168.77.77.51390 > server.clickmeeting.com.27724: UDP, length 1148
20:18:13.477891 IP 192.168.77.77.51390 > server.clickmeeting.com.27724: UDP, length 1148
20:18:13.480364 IP server.clickmeeting.com.23486 > 192.168.77.77.55330: UDP, length 50
20:18:13.488804 IP 192.168.77.77.51390 > server.clickmeeting.com.27724: UDP, length 138
20:18:13.491754 IP 192.168.77.77.55330 > server.clickmeeting.com.23486: UDP, length 810
20:18:13.494482 IP 192.168.77.77.51390 > server.clickmeeting.com.27724: UDP, length 1148
20:18:13.497349 IP 192.168.77.77.55330 > server.clickmeeting.com.23486: UDP, length 295
20:18:13.505188 IP 192.168.77.77.51390 > server.clickmeeting.com.27724: UDP, length 1148
20:18:13.507093 IP server.clickmeeting.com.27724 > 192.168.77.77.51390: UDP, length 50
20:18:13.513723 IP 192.168.77.77.55330 > server.clickmeeting.com.23486: UDP, length 811
20:18:13.516200 IP 192.168.77.77.51390 > server.clickmeeting.com.27724: UDP, length 1084
20:18:13.525626 IP 192.168.77.77.55330 > server.clickmeeting.com.23486: UDP, length 557
20:18:13.529073 IP 192.168.77.77.51390 > server.clickmeeting.com.27724: UDP, length 86
20:18:13.532633 IP 192.168.77.77.51390 > server.clickmeeting.com.27724: UDP, length 1084
20:18:13.543431 IP 192.168.77.77.51390 > server.clickmeeting.com.27724: UDP, length 1084
20:18:13.548729 IP 192.168.77.77.51390 > server.clickmeeting.com.27724: UDP, length 138
20:18:13.554378 IP 192.168.77.77.51390 > server.clickmeeting.com.27724: UDP, length 1085
20:18:13.557702 IP 192.168.77.77.55330 > server.clickmeeting.com.23486: UDP, length 324
20:18:13.563284 IP 192.168.77.77.55330 > server.clickmeeting.com.23486: UDP, length 991
20:18:13.570734 IP 192.168.77.77.51390 > server.clickmeeting.com.27724: UDP, length 900
20:18:13.576121 IP 192.168.77.77.51390 > server.clickmeeting.com.27724: UDP, length 900
20:18:13.579710 IP 192.168.77.77.55330 > server.clickmeeting.com.23486: UDP, length 991
20:18:13.587093 IP 192.168.77.77.51390 > server.clickmeeting.com.27724: UDP, length 900
20:18:13.598237 IP 192.168.77.77.51390 > server.clickmeeting.com.27724: UDP, length 1163
20:18:13.601551 IP 192.168.77.77.55330 > server.clickmeeting.com.23486: UDP, length 655
20:18:13.608971 IP 192.168.77.77.51390 > server.clickmeeting.com.27724: UDP, length 138
20:18:13.614280 IP 192.168.77.77.51390 > server.clickmeeting.com.27724: UDP, length 1163
20:18:13.617729 IP 192.168.77.77.55330 > server.clickmeeting.com.23486: UDP, length 316
20:18:13.623237 IP 192.168.77.77.55330 > server.clickmeeting.com.23486: UDP, length 655
20:18:13.625751 IP 192.168.77.77.51390 > server.clickmeeting.com.27724: UDP, length 933
20:18:13.636816 IP 192.168.77.77.51390 > server.clickmeeting.com.27724: UDP, length 934
20:18:13.647496 IP 192.168.77.77.51390 > server.clickmeeting.com.27724: UDP, length 934
20:18:13.661574 IP 192.168.77.77.55330 > server.clickmeeting.com.23486: UDP, length 837
20:18:13.669482 IP 192.168.77.77.51390 > server.clickmeeting.com.27724: UDP, length 138
20:18:13.669483 IP 192.168.77.77.55330 > server.clickmeeting.com.23486: UDP, length 70
20:18:13.672791 IP 192.168.77.77.55330 > server.clickmeeting.com.23486: UDP, length 837
20:18:13.674817 IP 192.168.77.77.51390 > server.clickmeeting.com.27724: UDP, length 1003
20:18:13.677800 IP 192.168.77.77.55330 > server.clickmeeting.com.23486: UDP, length 321
20:18:13.681310 IP server.clickmeeting.com.23486 > 192.168.77.77.55330: UDP, length 50
20:18:13.685640 IP 192.168.77.77.51390 > server.clickmeeting.com.27724: UDP, length 1003
20:18:13.696996 IP 192.168.77.77.51390 > server.clickmeeting.com.27724: UDP, length 1003
20:18:13.699753 IP 192.168.77.77.55330 > server.clickmeeting.com.23486: UDP, length 838
20:18:13.707183 IP server.clickmeeting.com.27724 > 192.168.77.77.51390: UDP, length 58
20:18:13.715966 IP 192.168.77.77.55330 > server.clickmeeting.com.23486: UDP, length 536
20:18:13.729005 IP 192.168.77.77.51390 > server.clickmeeting.com.27724: UDP, length 138
20:18:13.739369 IP 192.168.77.77.51390 > server.clickmeeting.com.27724: UDP, length 1194
20:18:13.739597 IP 192.168.77.77.55330 > server.clickmeeting.com.23486: UDP, length 299
20:18:13.750284 IP 192.168.77.77.51390 > server.clickmeeting.com.27724: UDP, length 1194
20:18:13.761265 IP 192.168.77.77.55330 > server.clickmeeting.com.23486: UDP, length 1184
20:18:13.761494 IP 192.168.77.77.51390 > server.clickmeeting.com.27724: UDP, length 1195
20:18:13.777814 IP 192.168.77.77.51390 > server.clickmeeting.com.27724: UDP, length 1195
20:18:13.780860 IP 192.168.77.77.55330 > server.clickmeeting.com.23486: UDP, length 1185
20:18:13.789887 IP 192.168.77.77.51390 > server.clickmeeting.com.27724: UDP, length 138
20:18:13.789888 IP 192.168.77.77.51390 > server.clickmeeting.com.27724: UDP, length 999
20:18:13.797558 IP 192.168.77.77.55330 > server.clickmeeting.com.23486: UDP, length 300
20:18:13.800921 IP 192.168.77.77.51390 > server.clickmeeting.com.27724: UDP, length 1000
20:18:13.802818 IP 192.168.77.77.55330 > server.clickmeeting.com.23486: UDP, length 602
20:18:13.811865 IP 192.168.77.77.51390 > server.clickmeeting.com.27724: UDP, length 1000
20:18:13.813582 IP 192.168.77.77.55330 > server.clickmeeting.com.23486: UDP, length 855
20:18:13.822645 IP 192.168.77.77.51390 > server.clickmeeting.com.27724: UDP, length 1000
20:18:13.830073 IP 192.168.77.77.55330 > server.clickmeeting.com.23486: UDP, length 856
20:18:13.833721 IP 192.168.77.77.51390 > server.clickmeeting.com.27724: UDP, length 1000
20:18:13.844650 IP 192.168.77.77.51390 > server.clickmeeting.com.27724: UDP, length 1012
20:18:13.849885 IP 192.168.77.77.51390 > server.clickmeeting.com.27724: UDP, length 138
20:18:13.851960 IP 192.168.77.77.55330 > server.clickmeeting.com.23486: UDP, length 856
20:18:13.855245 IP 192.168.77.77.51390 > server.clickmeeting.com.27724: UDP, length 1012
20:18:13.857206 IP 192.168.77.77.55330 > server.clickmeeting.com.23486: UDP, length 289
20:18:13.866624 IP 192.168.77.77.51390 > server.clickmeeting.com.27724: UDP, length 1013
20:18:13.873868 IP 192.168.77.77.55330 > server.clickmeeting.com.23486: UDP, length 1075
20:18:13.877244 IP 192.168.77.77.51390 > server.clickmeeting.com.27724: UDP, length 921
20:18:13.881615 IP server.clickmeeting.com.23486 > 192.168.77.77.55330: UDP, length 50
20:18:13.888041 IP 192.168.77.77.51390 > server.clickmeeting.com.27724: UDP, length 921
20:18:13.896116 IP 192.168.77.77.55330 > server.clickmeeting.com.23486: UDP, length 1075
20:18:13.899322 IP 192.168.77.77.51390 > server.clickmeeting.com.27724: UDP, length 921
20:18:13.908306 IP server.clickmeeting.com.27724 > 192.168.77.77.51390: UDP, length 54
20:18:13.909931 IP 192.168.77.77.51390 > server.clickmeeting.com.27724: UDP, length 138
20:18:13.912027 IP 192.168.77.77.55330 > server.clickmeeting.com.23486: UDP, length 870
20:18:13.917309 IP 192.168.77.77.55330 > server.clickmeeting.com.23486: UDP, length 257
20:18:13.926576 IP 192.168.77.77.51390 > server.clickmeeting.com.27724: UDP, length 1095
20:18:13.937257 IP 192.168.77.77.51390 > server.clickmeeting.com.27724: UDP, length 1096
20:18:13.939332 IP 192.168.77.77.55330 > server.clickmeeting.com.23486: UDP, length 870
20:18:13.948139 IP 192.168.77.77.51390 > server.clickmeeting.com.27724: UDP, length 1096
20:18:13.955462 IP 192.168.77.77.55330 > server.clickmeeting.com.23486: UDP, length 607
20:18:13.970074 IP 192.168.77.77.51390 > server.clickmeeting.com.27724: UDP, length 138
20:18:13.972039 IP 192.168.77.77.55330 > server.clickmeeting.com.23486: UDP, length 846
20:18:13.977382 IP 192.168.77.77.55330 > server.clickmeeting.com.23486: UDP, length 277
20:18:13.980922 IP 192.168.77.77.51390 > server.clickmeeting.com.27724: UDP, length 1073
20:18:13.991777 IP 192.168.77.77.51390 > server.clickmeeting.com.27724: UDP, length 1074
20:18:13.993693 IP 192.168.77.77.55330 > server.clickmeeting.com.23486: UDP, length 847
20:18:14.000348 IP 192.168.77.77.51390 > server.clickmeeting.com.27724: UDP, length 22
20:18:14.002704 IP 192.168.77.77.51390 > server.clickmeeting.com.27724: UDP, length 1074
20:18:14.010155 IP 192.168.77.77.55330 > server.clickmeeting.com.23486: UDP, length 847
20:18:14.013605 IP 192.168.77.77.51390 > server.clickmeeting.com.27724: UDP, length 1074
20:18:14.015222 IP server.clickmeeting.com.23486 > 192.168.77.77.55330: UDP, length 28
20:18:14.030826 IP 192.168.77.77.51390 > server.clickmeeting.com.27724: UDP, length 138
20:18:14.030869 IP 192.168.77.77.51390 > server.clickmeeting.com.27724: UDP, length 1040
20:18:14.037425 IP 192.168.77.77.55330 > server.clickmeeting.com.23486: UDP, length 280
20:18:14.041520 IP 192.168.77.77.51390 > server.clickmeeting.com.27724: UDP, length 1040
20:18:14.042827 IP 192.168.77.77.55330 > server.clickmeeting.com.23486: UDP, length 873
20:18:14.052246 IP 192.168.77.77.51390 > server.clickmeeting.com.27724: UDP, length 1040
20:18:14.053619 IP 192.168.77.77.51390 > server.clickmeeting.com.27724: UDP, length 100
20:18:14.059444 IP 192.168.77.77.55330 > server.clickmeeting.com.23486: UDP, length 874
20:18:14.059446 IP 192.168.77.77.55330 > server.clickmeeting.com.23486: UDP, length 22
20:18:14.063183 IP 192.168.77.77.51390 > server.clickmeeting.com.27724: UDP, length 1040
20:18:14.074217 IP 192.168.77.77.51390 > server.clickmeeting.com.27724: UDP, length 1040
20:18:14.075789 IP 192.168.77.77.55330 > server.clickmeeting.com.23486: UDP, length 915
20:18:14.082442 IP server.clickmeeting.com.23486 > 192.168.77.77.55330: UDP, length 50
20:18:14.084936 IP 192.168.77.77.51390 > server.clickmeeting.com.27724: UDP, length 949
20:18:14.090453 IP 192.168.77.77.51390 > server.clickmeeting.com.27724: UDP, length 138
20:18:14.092377 IP 192.168.77.77.55330 > server.clickmeeting.com.23486: UDP, length 916
20:18:14.095929 IP 192.168.77.77.51390 > server.clickmeeting.com.27724: UDP, length 949
20:18:14.096860 IP 192.168.77.77.55330 > server.clickmeeting.com.23486: UDP, length 272
20:18:14.106843 IP 192.168.77.77.51390 > server.clickmeeting.com.27724: UDP, length 950
20:18:14.108687 IP server.clickmeeting.com.27724 > 192.168.77.77.51390: UDP, length 58
20:18:14.118730 IP 192.168.77.77.55330 > server.clickmeeting.com.23486: UDP, length 760
20:18:14.128661 IP 192.168.77.77.51390 > server.clickmeeting.com.27724: UDP, length 254
20:18:14.128662 IP 192.168.77.77.51390 > server.clickmeeting.com.27724: UDP, length 946
20:18:14.129528 IP 192.168.77.77.55330 > server.clickmeeting.com.23486: UDP, length 761
20:18:14.135309 IP 192.168.77.77.51390 > server.clickmeeting.com.27724: UDP, length 946
20:18:14.140577 IP 192.168.77.77.51390 > server.clickmeeting.com.27724: UDP, length 946
20:18:14.145084 IP 192.168.77.77.51390 > server.clickmeeting.com.27724: UDP, length 952
20:18:14.145960 IP 192.168.77.77.55330 > server.clickmeeting.com.23486: UDP, length 930
20:18:14.149453 IP 192.168.77.77.51390 > server.clickmeeting.com.27724: UDP, length 138
20:18:14.149454 IP 192.168.77.77.51390 > server.clickmeeting.com.27724: UDP, length 254
20:18:14.151431 IP 192.168.77.77.32460 > xiva-daria.stable.qloud-b.yandex.net.https: Flags [.], seq 1161906255:1161906256, ack 1530543676, win 1024, length 1
20:18:14.155111 IP xiva-daria.stable.qloud-b.yandex.net.https > 192.168.77.77.32460: Flags [.], ack 1, win 166, options [nop,nop,sack 1 {0:1}], length 0
20:18:14.156818 IP 192.168.77.77.55330 > server.clickmeeting.com.23486: UDP, length 292
20:18:14.173717 IP 192.168.77.77.55330 > server.clickmeeting.com.23486: UDP, length 931
20:18:14.175269 IP server.clickmeeting.com.27724 > 192.168.77.77.51390: UDP, length 80
20:18:14.176800 IP 192.168.77.77.51390 > server.clickmeeting.com.27724: UDP, length 254
20:18:14.182227 IP 192.168.77.77.51390 > server.clickmeeting.com.27724: UDP, length 1116
20:18:14.182673 IP ubuntu20-04.41240 > router.lan.domain: 42224+ PTR? 179.204.180.213.in-addr.arpa. (46)
20:18:14.193140 IP 192.168.77.77.51390 > server.clickmeeting.com.27724: UDP, length 1116
20:18:14.204278 IP 192.168.77.77.51390 > server.clickmeeting.com.27724: UDP, length 1117
20:18:14.205065 IP 192.168.77.77.55330 > server.clickmeeting.com.23486: UDP, length 881
20:18:14.209529 IP 192.168.77.77.51390 > server.clickmeeting.com.27724: UDP, length 138
20:18:14.215927 IP 192.168.77.77.55330 > server.clickmeeting.com.23486: UDP, length 291
20:18:14.220426 IP 192.168.77.77.51390 > server.clickmeeting.com.27724: UDP, length 1117
20:18:14.226939 IP 192.168.77.77.55330 > server.clickmeeting.com.23486: UDP, length 882
20:18:14.231653 IP 192.168.77.77.51390 > server.clickmeeting.com.27724: UDP, length 1150
20:18:14.234495 IP server.clickmeeting.com.27724 > 192.168.77.77.51390: UDP, length 46
20:18:14.234496 IP server.clickmeeting.com.27724 > 192.168.77.77.51390: UDP, length 46
20:18:14.234734 IP server.clickmeeting.com.23486 > 192.168.77.77.55330: UDP, length 46
20:18:14.234734 IP server.clickmeeting.com.23486 > 192.168.77.77.55330: UDP, length 46
20:18:14.242411 IP 192.168.77.77.51390 > server.clickmeeting.com.27724: UDP, length 1151
20:18:14.243232 IP 192.168.77.77.55330 > server.clickmeeting.com.23486: UDP, length 796
20:18:14.258636 IP 192.168.77.77.51390 > server.clickmeeting.com.27724: UDP, length 1151
20:18:14.259588 IP 192.168.77.77.55330 > server.clickmeeting.com.23486: UDP, length 796
20:18:14.269727 IP 192.168.77.77.51390 > server.clickmeeting.com.27724: UDP, length 138
20:18:14.269729 IP 192.168.77.77.51390 > server.clickmeeting.com.27724: UDP, length 1151
20:18:14.276350 IP 192.168.77.77.55330 > server.clickmeeting.com.23486: UDP, length 287
20:18:14.281883 IP 192.168.77.77.55330 > server.clickmeeting.com.23486: UDP, length 874
20:18:14.282317 IP server.clickmeeting.com.23486 > 192.168.77.77.55330: UDP, length 50
20:18:14.285757 IP 192.168.77.77.51390 > server.clickmeeting.com.27724: UDP, length 922
20:18:14.291210 IP 192.168.77.77.51390 > server.clickmeeting.com.27724: UDP, length 922
20:18:14.293749 IP server.clickmeeting.com.23486 > 192.168.77.77.55330: UDP, length 46
20:18:14.295476 IP router.lan.domain > ubuntu20-04.41240: 42224 1/0/0 PTR xiva-daria.stable.qloud-b.yandex.net. (96)
20:18:14.298552 IP 192.168.77.77.55330 > server.clickmeeting.com.23486: UDP, length 874
20:18:14.309249 IP server.clickmeeting.com.27724 > 192.168.77.77.51390: UDP, length 58
20:18:14.314661 IP 192.168.77.77.55330 > server.clickmeeting.com.23486: UDP, length 842
20:18:14.329572 IP 192.168.77.77.51390 > server.clickmeeting.com.27724: UDP, length 138
20:18:14.331510 IP 192.168.77.77.55330 > server.clickmeeting.com.23486: UDP, length 842
20:18:14.335207 IP 192.168.77.77.51390 > server.clickmeeting.com.27724: UDP, length 877
20:18:14.336758 IP 192.168.77.77.55330 > server.clickmeeting.com.23486: UDP, length 246
20:18:14.340662 IP 192.168.77.77.51390 > server.clickmeeting.com.27724: UDP, length 877
20:18:14.351331 IP 192.168.77.77.51390 > server.clickmeeting.com.27724: UDP, length 878
20:18:14.352758 IP 192.168.77.77.55330 > server.clickmeeting.com.23486: UDP, length 424
20:18:14.356283 IP 192.168.77.77.51390 > server.clickmeeting.com.27724: UDP, length 86
20:18:14.384091 IP 192.168.77.77.51390 > server.clickmeeting.com.27724: UDP, length 1165
20:18:14.389481 IP 192.168.77.77.51390 > server.clickmeeting.com.27724: UDP, length 138
20:18:14.394994 IP 192.168.77.77.51390 > server.clickmeeting.com.27724: UDP, length 1165
20:18:14.396477 IP 192.168.77.77.55330 > server.clickmeeting.com.23486: UDP, length 251
20:18:14.407430 IP 192.168.77.77.55330 > server.clickmeeting.com.23486: UDP, length 831
20:18:14.411559 IP 192.168.77.77.51390 > server.clickmeeting.com.27724: UDP, length 1165
20:18:14.422230 IP 192.168.77.77.51390 > server.clickmeeting.com.27724: UDP, length 1166
20:18:14.423687 IP 192.168.77.77.55330 > server.clickmeeting.com.23486: UDP, length 831
20:18:14.433295 IP 192.168.77.77.51390 > server.clickmeeting.com.27724: UDP, length 1192
20:18:14.440147 IP 192.168.77.77.55330 > server.clickmeeting.com.23486: UDP, length 832
20:18:14.449557 IP 192.168.77.77.51390 > server.clickmeeting.com.27724: UDP, length 138
20:18:14.449558 IP 192.168.77.77.51390 > server.clickmeeting.com.27724: UDP, length 1193
20:18:14.456570 IP 192.168.77.77.55330 > server.clickmeeting.com.23486: UDP, length 246
20:18:14.460773 IP 192.168.77.77.51390 > server.clickmeeting.com.27724: UDP, length 1193
20:18:14.461930 IP 192.168.77.77.55330 > server.clickmeeting.com.23486: UDP, length 814
20:18:14.470479 IP 192.168.77.77.55330 > server.clickmeeting.com.23486: UDP, length 100
20:18:14.477270 IP 192.168.77.77.51390 > server.clickmeeting.com.27724: UDP, length 1193
20:18:14.478408 IP 192.168.77.77.55330 > server.clickmeeting.com.23486: UDP, length 814
20:18:14.482822 IP server.clickmeeting.com.23486 > 192.168.77.77.55330: UDP, length 50
20:18:14.487718 IP 192.168.77.77.51390 > server.clickmeeting.com.27724: UDP, length 989
20:18:14.494752 IP 192.168.77.77.55330 > server.clickmeeting.com.23486: UDP, length 904
20:18:14.498843 IP 192.168.77.77.51390 > server.clickmeeting.com.27724: UDP, length 989
20:18:14.509155 IP server.clickmeeting.com.27724 > 192.168.77.77.51390: UDP, length 54
20:18:14.509639 IP 192.168.77.77.51390 > server.clickmeeting.com.27724: UDP, length 138
20:18:14.509640 IP 192.168.77.77.51390 > server.clickmeeting.com.27724: UDP, length 989
20:18:14.511085 IP 192.168.77.77.55330 > server.clickmeeting.com.23486: UDP, length 904
20:18:14.516512 IP 192.168.77.77.55330 > server.clickmeeting.com.23486: UDP, length 280
20:18:14.520394 IP 192.168.77.77.51390 > server.clickmeeting.com.27724: UDP, length 989
20:18:14.531706 IP 192.168.77.77.51390 > server.clickmeeting.com.27724: UDP, length 1108
20:18:14.538408 IP 192.168.77.77.55330 > server.clickmeeting.com.23486: UDP, length 800
20:18:14.542610 IP 192.168.77.77.51390 > server.clickmeeting.com.27724: UDP, length 1109
20:18:14.554695 IP 192.168.77.77.55330 > server.clickmeeting.com.23486: UDP, length 801
20:18:14.558692 IP 192.168.77.77.51390 > server.clickmeeting.com.27724: UDP, length 1109
20:18:14.570672 IP 192.168.77.77.51390 > server.clickmeeting.com.27724: UDP, length 138
20:18:14.570673 IP 192.168.77.77.51390 > server.clickmeeting.com.27724: UDP, length 1109
20:18:14.574265 IP 192.168.77.77.51390 > server.clickmeeting.com.27724: UDP, length 22
20:18:14.577632 IP 192.168.77.77.55330 > server.clickmeeting.com.23486: UDP, length 276
20:18:14.582971 IP 192.168.77.77.55330 > server.clickmeeting.com.23486: UDP, length 851
20:18:14.585829 IP 192.168.77.77.51390 > server.clickmeeting.com.27724: UDP, length 926
20:18:14.589948 IP server.clickmeeting.com.23486 > 192.168.77.77.55330: UDP, length 80
20:18:14.591303 IP 192.168.77.77.51390 > server.clickmeeting.com.27724: UDP, length 926
20:18:14.599536 IP 192.168.77.77.55330 > server.clickmeeting.com.23486: UDP, length 852
20:18:14.602360 IP 192.168.77.77.51390 > server.clickmeeting.com.27724: UDP, length 926
20:18:14.613223 IP 192.168.77.77.51390 > server.clickmeeting.com.27724: UDP, length 927
20:18:14.615635 IP 192.168.77.77.55330 > server.clickmeeting.com.23486: UDP, length 725
20:18:14.629686 IP 192.168.77.77.51390 > server.clickmeeting.com.27724: UDP, length 138
20:18:14.632214 IP 192.168.77.77.55330 > server.clickmeeting.com.23486: UDP, length 725
20:18:14.635171 IP 192.168.77.77.51390 > server.clickmeeting.com.27724: UDP, length 1192
20:18:14.638264 IP 192.168.77.77.55330 > server.clickmeeting.com.23486: UDP, length 277
20:18:14.645991 IP 192.168.77.77.51390 > server.clickmeeting.com.27724: UDP, length 1192
20:18:14.648401 IP 192.168.77.77.55330 > server.clickmeeting.com.23486: UDP, length 827
20:18:14.656852 IP 192.168.77.77.51390 > server.clickmeeting.com.27724: UDP, length 1192
20:18:14.665011 IP 192.168.77.77.55330 > server.clickmeeting.com.23486: UDP, length 828
20:18:14.681205 IP 192.168.77.77.55330 > server.clickmeeting.com.23486: UDP, length 845
20:18:14.683734 IP server.clickmeeting.com.23486 > 192.168.77.77.55330: UDP, length 50
20:18:14.684066 IP 192.168.77.77.51390 > server.clickmeeting.com.27724: UDP, length 991
20:18:14.689507 IP 192.168.77.77.51390 > server.clickmeeting.com.27724: UDP, length 138
20:18:14.695101 IP 192.168.77.77.51390 > server.clickmeeting.com.27724: UDP, length 991
20:18:14.697778 IP 192.168.77.77.55330 > server.clickmeeting.com.23486: UDP, length 304
20:18:14.703060 IP 192.168.77.77.51390 > server.clickmeeting.com.27724: UDP, length 86
20:18:14.703072 IP 192.168.77.77.55330 > server.clickmeeting.com.23486: UDP, length 846
20:18:14.706579 IP 192.168.77.77.51390 > server.clickmeeting.com.27724: UDP, length 991
20:18:14.709825 IP server.clickmeeting.com.27724 > 192.168.77.77.51390: UDP, length 58
20:18:14.716864 IP 192.168.77.77.51390 > server.clickmeeting.com.27724: UDP, length 991
20:18:14.733313 IP 192.168.77.77.51390 > server.clickmeeting.com.27724: UDP, length 1190
20:18:14.745192 IP 192.168.77.77.51390 > server.clickmeeting.com.27724: UDP, length 1190
20:18:14.746685 IP 192.168.77.77.55330 > server.clickmeeting.com.23486: UDP, length 731
20:18:14.750513 IP 192.168.77.77.51390 > server.clickmeeting.com.27724: UDP, length 138
20:18:14.755994 IP 192.168.77.77.51390 > server.clickmeeting.com.27724: UDP, length 1190
20:18:14.757445 IP 192.168.77.77.55330 > server.clickmeeting.com.23486: UDP, length 307
20:18:14.763249 IP 192.168.77.77.55330 > server.clickmeeting.com.23486: UDP, length 731
20:18:14.779803 IP 192.168.77.77.55330 > server.clickmeeting.com.23486: UDP, length 894
20:18:14.783364 IP 192.168.77.77.51390 > server.clickmeeting.com.27724: UDP, length 717
20:18:14.788727 IP 192.168.77.77.51390 > server.clickmeeting.com.27724: UDP, length 717
20:18:14.795284 IP 192.168.77.77.55330 > server.clickmeeting.com.23486: UDP, length 894
20:18:14.810942 IP 192.168.77.77.51390 > server.clickmeeting.com.27724: UDP, length 138
20:18:14.816638 IP 192.168.77.77.55330 > server.clickmeeting.com.23486: UDP, length 300
20:18:14.821956 IP 192.168.77.77.55330 > server.clickmeeting.com.23486: UDP, length 781
20:18:14.830725 IP 192.168.77.77.51390 > server.clickmeeting.com.27724: UDP, length 70
20:18:14.837981 IP 192.168.77.77.51390 > server.clickmeeting.com.27724: UDP, length 1145
20:18:14.838362 IP 192.168.77.77.55330 > server.clickmeeting.com.23486: UDP, length 782
20:18:14.848811 IP 192.168.77.77.51390 > server.clickmeeting.com.27724: UDP, length 1145
20:18:14.854708 IP 192.168.77.77.55330 > server.clickmeeting.com.23486: UDP, length 846
20:18:14.859990 IP 192.168.77.77.51390 > server.clickmeeting.com.27724: UDP, length 1145
20:18:14.870725 IP 192.168.77.77.51390 > server.clickmeeting.com.27724: UDP, length 138
20:18:14.871074 IP 192.168.77.77.55330 > server.clickmeeting.com.23486: UDP, length 846
20:18:14.876772 IP 192.168.77.77.51390 > server.clickmeeting.com.27724: UDP, length 1145
20:18:14.877414 IP 192.168.77.77.55330 > server.clickmeeting.com.23486: UDP, length 276
20:18:14.884087 IP server.clickmeeting.com.23486 > 192.168.77.77.55330: UDP, length 50
20:18:14.888509 IP 192.168.77.77.51390 > server.clickmeeting.com.27724: UDP, length 1145
20:18:14.894078 IP 192.168.77.77.55330 > server.clickmeeting.com.23486: UDP, length 947
20:18:14.899453 IP 192.168.77.77.51390 > server.clickmeeting.com.27724: UDP, length 1145
20:18:14.910373 IP server.clickmeeting.com.27724 > 192.168.77.77.51390: UDP, length 54
20:18:14.910573 IP 192.168.77.77.55330 > server.clickmeeting.com.23486: UDP, length 947
20:18:14.910777 IP 192.168.77.77.51390 > server.clickmeeting.com.27724: UDP, length 1146
20:18:14.920732 IP 192.168.77.77.51390 > server.clickmeeting.com.27724: UDP, length 1146
20:18:14.932304 IP 192.168.77.77.51390 > server.clickmeeting.com.27724: UDP, length 138
20:18:14.937223 IP 192.168.77.77.51390 > server.clickmeeting.com.27724: UDP, length 988
20:18:14.937578 IP 192.168.77.77.55330 > server.clickmeeting.com.23486: UDP, length 298
20:18:14.949008 IP 192.168.77.77.51390 > server.clickmeeting.com.27724: UDP, length 988
20:18:14.949021 IP 192.168.77.77.55330 > server.clickmeeting.com.23486: UDP, length 872
20:18:14.959943 IP 192.168.77.77.51390 > server.clickmeeting.com.27724: UDP, length 988
20:18:14.965431 IP 192.168.77.77.55330 > server.clickmeeting.com.23486: UDP, length 873
20:18:14.970936 IP 192.168.77.77.51390 > server.clickmeeting.com.27724: UDP, length 947
20:18:14.977411 IP 192.168.77.77.51390 > server.clickmeeting.com.27724: UDP, length 947
20:18:14.982762 IP 192.168.77.77.55330 > server.clickmeeting.com.23486: UDP, length 873
20:18:14.988256 IP 192.168.77.77.51390 > server.clickmeeting.com.27724: UDP, length 138
20:18:14.988258 IP 192.168.77.77.51390 > server.clickmeeting.com.27724: UDP, length 947
20:18:14.993659 IP 192.168.77.77.55330 > server.clickmeeting.com.23486: UDP, length 273
20:18:14.999161 IP 192.168.77.77.51390 > server.clickmeeting.com.27724: UDP, length 948
20:18:15.004659 IP 192.168.77.77.55330 > server.clickmeeting.com.23486: UDP, length 333
20:18:15.011119 IP 192.168.77.77.51390 > server.clickmeeting.com.27724: UDP, length 1086
20:18:15.015562 IP 192.168.77.77.55330 > server.clickmeeting.com.23486: UDP, length 1170
20:18:15.020968 IP 192.168.77.77.51390 > server.clickmeeting.com.27724: UDP, length 1086
20:18:15.032395 IP 192.168.77.77.51390 > server.clickmeeting.com.27724: UDP, length 1086
20:18:15.033956 IP 192.168.77.77.51390 > server.clickmeeting.com.27724: UDP, length 22
20:18:15.037417 IP 192.168.77.77.55330 > server.clickmeeting.com.23486: UDP, length 1170
20:18:15.043632 IP 192.168.77.77.51390 > server.clickmeeting.com.27724: UDP, length 1202
20:18:15.048710 IP 192.168.77.77.51390 > server.clickmeeting.com.27724: UDP, length 138
20:18:15.054179 IP 192.168.77.77.55330 > server.clickmeeting.com.23486: UDP, length 263
20:18:15.059654 IP 192.168.77.77.55330 > server.clickmeeting.com.23486: UDP, length 70
20:18:15.059665 IP 192.168.77.77.51390 > server.clickmeeting.com.27724: UDP, length 1202
20:18:15.065153 IP 192.168.77.77.55330 > server.clickmeeting.com.23486: UDP, length 1090
20:18:15.070610 IP 192.168.77.77.51390 > server.clickmeeting.com.27724: UDP, length 1203
20:18:15.081521 IP 192.168.77.77.51390 > server.clickmeeting.com.27724: UDP, length 1203
20:18:15.084660 IP server.clickmeeting.com.23486 > 192.168.77.77.55330: UDP, length 50
20:18:15.086830 IP 192.168.77.77.55330 > server.clickmeeting.com.23486: UDP, length 1091
20:18:15.097985 IP 192.168.77.77.51390 > server.clickmeeting.com.27724: UDP, length 968
20:18:15.103287 IP 192.168.77.77.51390 > server.clickmeeting.com.27724: UDP, length 969
20:18:15.108877 IP 192.168.77.77.51390 > server.clickmeeting.com.27724: UDP, length 138
20:18:15.110752 IP server.clickmeeting.com.27724 > 192.168.77.77.51390: UDP, length 54
20:18:15.114201 IP 192.168.77.77.55330 > server.clickmeeting.com.23486: UDP, length 283
20:18:15.118623 IP 192.168.77.77.51390 > server.clickmeeting.com.27724: UDP, length 969
20:18:15.119566 IP 192.168.77.77.55330 > server.clickmeeting.com.23486: UDP, length 628
20:18:15.129907 IP 192.168.77.77.51390 > server.clickmeeting.com.27724: UDP, length 969
20:18:15.130849 IP 192.168.77.77.55330 > server.clickmeeting.com.23486: UDP, length 628
20:18:15.140496 IP 192.168.77.77.51390 > server.clickmeeting.com.27724: UDP, length 1183
20:18:15.151419 IP 192.168.77.77.51390 > server.clickmeeting.com.27724: UDP, length 1184
20:18:15.152270 IP 192.168.77.77.55330 > server.clickmeeting.com.23486: UDP, length 1103
20:18:15.167832 IP 192.168.77.77.51390 > server.clickmeeting.com.27724: UDP, length 138
20:18:15.167834 IP 192.168.77.77.51390 > server.clickmeeting.com.27724: UDP, length 1184
20:18:15.174350 IP 192.168.77.77.55330 > server.clickmeeting.com.23486: UDP, length 256
20:18:15.185156 IP 192.168.77.77.55330 > server.clickmeeting.com.23486: UDP, length 716
20:18:15.189548 IP 192.168.77.77.51390 > server.clickmeeting.com.27724: UDP, length 839
20:18:15.195166 IP 192.168.77.77.51390 > server.clickmeeting.com.27724: UDP, length 839
20:18:15.196262 IP 192.168.77.77.55330 > server.clickmeeting.com.23486: UDP, length 716
20:18:15.202294 STP 802.1w, Rapid STP, Flags [Learn, Forward], bridge-id 8000.48:8f:5a:98:f5:bc.8003, length 43
20:18:15.205986 IP 192.168.77.77.51390 > server.clickmeeting.com.27724: UDP, length 840
20:18:15.217394 IP 192.168.77.77.55330 > server.clickmeeting.com.23486: UDP, length 1151
20:18:15.228388 IP 192.168.77.77.51390 > server.clickmeeting.com.27724: UDP, length 138
20:18:15.229922 IP 192.168.77.77.51390 > server.clickmeeting.com.27724: UDP, length 86
20:18:15.232954 IP server.clickmeeting.com.23486 > 192.168.77.77.55330: UDP, length 46
20:18:15.232957 IP server.clickmeeting.com.23486 > 192.168.77.77.55330: UDP, length 46
20:18:15.234133 IP 192.168.77.77.55330 > server.clickmeeting.com.23486: UDP, length 231
20:18:15.234471 IP server.clickmeeting.com.27724 > 192.168.77.77.51390: UDP, length 46
20:18:15.234472 IP server.clickmeeting.com.27724 > 192.168.77.77.51390: UDP, length 46
20:18:15.239296 IP 192.168.77.77.51390 > server.clickmeeting.com.27724: UDP, length 1015
20:18:15.250103 IP 192.168.77.77.51390 > server.clickmeeting.com.27724: UDP, length 1016
20:18:15.261021 IP 192.168.77.77.51390 > server.clickmeeting.com.27724: UDP, length 1016
20:18:15.285257 IP server.clickmeeting.com.23486 > 192.168.77.77.55330: UDP, length 50
20:18:15.287792 IP 192.168.77.77.55330 > server.clickmeeting.com.23486: UDP, length 735
20:18:15.288175 IP 192.168.77.77.51390 > server.clickmeeting.com.27724: UDP, length 138
20:18:15.288224 IP 192.168.77.77.51390 > server.clickmeeting.com.27724: UDP, length 970
20:18:15.293268 IP 192.168.77.77.55330 > server.clickmeeting.com.23486: UDP, length 231
20:18:15.299273 IP 192.168.77.77.51390 > server.clickmeeting.com.27724: UDP, length 970
20:18:15.304175 IP 192.168.77.77.55330 > server.clickmeeting.com.23486: UDP, length 736
20:18:15.310116 IP 192.168.77.77.51390 > server.clickmeeting.com.27724: UDP, length 970
20:18:15.310767 IP server.clickmeeting.com.27724 > 192.168.77.77.51390: UDP, length 58
20:18:15.320528 IP 192.168.77.77.55330 > server.clickmeeting.com.23486: UDP, length 641
20:18:15.331886 IP 192.168.77.77.55330 > server.clickmeeting.com.23486: UDP, length 641
20:18:15.342822 IP 192.168.77.77.51390 > server.clickmeeting.com.27724: UDP, length 1086
20:18:15.348370 IP 192.168.77.77.51390 > server.clickmeeting.com.27724: UDP, length 138
20:18:15.348371 IP 192.168.77.77.55330 > server.clickmeeting.com.23486: UDP, length 22
20:18:15.353747 IP 192.168.77.77.55330 > server.clickmeeting.com.23486: UDP, length 216
20:18:15.353748 IP 192.168.77.77.51390 > server.clickmeeting.com.27724: UDP, length 1087
20:18:15.353782 IP 192.168.77.77.55330 > server.clickmeeting.com.23486: UDP, length 600
20:18:15.386656 IP 192.168.77.77.55330 > server.clickmeeting.com.23486: UDP, length 1067
20:18:15.391955 IP 192.168.77.77.51390 > server.clickmeeting.com.27724: UDP, length 726
20:18:15.397472 IP 192.168.77.77.51390 > server.clickmeeting.com.27724: UDP, length 727
20:18:15.402875 IP 192.168.77.77.55330 > server.clickmeeting.com.23486: UDP, length 1068
20:18:15.408333 IP 192.168.77.77.51390 > server.clickmeeting.com.27724: UDP, length 138
20:18:15.414181 IP 192.168.77.77.55330 > server.clickmeeting.com.23486: UDP, length 253
20:18:15.441142 IP 192.168.77.77.51390 > server.clickmeeting.com.27724: UDP, length 982
20:18:15.452027 IP 192.168.77.77.51390 > server.clickmeeting.com.27724: UDP, length 983
20:18:15.453358 IP 192.168.77.77.55330 > server.clickmeeting.com.23486: UDP, length 924
20:18:15.462995 IP 192.168.77.77.51390 > server.clickmeeting.com.27724: UDP, length 983
20:18:15.468331 IP 192.168.77.77.51390 > server.clickmeeting.com.27724: UDP, length 138
20:18:15.469824 IP 192.168.77.77.55330 > server.clickmeeting.com.23486: UDP, length 925
20:18:15.475596 IP 192.168.77.77.55330 > server.clickmeeting.com.23486: UDP, length 270
20:18:15.485581 IP server.clickmeeting.com.23486 > 192.168.77.77.55330: UDP, length 50
20:18:15.490166 IP 192.168.77.77.51390 > server.clickmeeting.com.27724: UDP, length 1094
20:18:15.492145 IP 192.168.77.77.55330 > server.clickmeeting.com.23486: UDP, length 925
20:18:15.501127 IP 192.168.77.77.51390 > server.clickmeeting.com.27724: UDP, length 1094
20:18:15.508744 IP 192.168.77.77.55330 > server.clickmeeting.com.23486: UDP, length 954
20:18:15.511036 IP server.clickmeeting.com.27724 > 192.168.77.77.51390: UDP, length 50
20:18:15.512192 IP 192.168.77.77.51390 > server.clickmeeting.com.27724: UDP, length 1094
20:18:15.522896 IP 192.168.77.77.51390 > server.clickmeeting.com.27724: UDP, length 1095
20:18:15.528556 IP 192.168.77.77.51390 > server.clickmeeting.com.27724: UDP, length 138
20:18:15.530468 IP 192.168.77.77.55330 > server.clickmeeting.com.23486: UDP, length 955
20:18:15.536149 IP 192.168.77.77.55330 > server.clickmeeting.com.23486: UDP, length 308
20:18:15.550232 IP 192.168.77.77.51390 > server.clickmeeting.com.27724: UDP, length 1187
20:18:15.552187 IP 192.168.77.77.55330 > server.clickmeeting.com.23486: UDP, length 497
20:18:15.561208 IP 192.168.77.77.51390 > server.clickmeeting.com.27724: UDP, length 1187
20:18:15.563141 IP 192.168.77.77.55330 > server.clickmeeting.com.23486: UDP, length 1146
20:18:15.572088 IP 192.168.77.77.51390 > server.clickmeeting.com.27724: UDP, length 1187
20:18:15.584984 IP 192.168.77.77.55330 > server.clickmeeting.com.23486: UDP, length 1147
20:18:15.588369 IP 192.168.77.77.51390 > server.clickmeeting.com.27724: UDP, length 138
20:18:15.588371 IP 192.168.77.77.51390 > server.clickmeeting.com.27724: UDP, length 1188
20:18:15.595926 IP 192.168.77.77.55330 > server.clickmeeting.com.23486: UDP, length 293
20:18:15.599364 IP 192.168.77.77.51390 > server.clickmeeting.com.27724: UDP, length 1107
20:18:15.616699 IP 192.168.77.77.51390 > server.clickmeeting.com.27724: UDP, length 1108
20:18:15.617532 IP 192.168.77.77.55330 > server.clickmeeting.com.23486: UDP, length 956
20:18:15.626763 IP 192.168.77.77.51390 > server.clickmeeting.com.27724: UDP, length 1108
20:18:15.634119 IP 192.168.77.77.55330 > server.clickmeeting.com.23486: UDP, length 956
20:18:15.642475 IP 192.168.77.77.51390 > server.clickmeeting.com.27724: UDP, length 1126
20:18:15.647813 IP 192.168.77.77.51390 > server.clickmeeting.com.27724: UDP, length 138
20:18:15.653406 IP 192.168.77.77.51390 > server.clickmeeting.com.27724: UDP, length 1126
20:18:15.655336 IP 192.168.77.77.55330 > server.clickmeeting.com.23486: UDP, length 291
20:18:15.660965 IP 192.168.77.77.55330 > server.clickmeeting.com.23486: UDP, length 1122
20:18:15.664349 IP 192.168.77.77.51390 > server.clickmeeting.com.27724: UDP, length 1126
20:18:15.682661 IP 192.168.77.77.55330 > server.clickmeeting.com.23486: UDP, length 1123
20:18:15.686213 IP server.clickmeeting.com.23486 > 192.168.77.77.55330: UDP, length 50
20:18:15.691791 IP 192.168.77.77.51390 > server.clickmeeting.com.27724: UDP, length 1015
20:18:15.696132 IP 192.168.77.77.51390 > server.clickmeeting.com.27724: UDP, length 22
20:18:15.702052 IP 192.168.77.77.51390 > server.clickmeeting.com.27724: UDP, length 1016
20:18:15.704455 IP 192.168.77.77.55330 > server.clickmeeting.com.23486: UDP, length 1140
20:18:15.707626 IP 192.168.77.77.51390 > server.clickmeeting.com.27724: UDP, length 1016
20:18:15.711219 IP server.clickmeeting.com.27724 > 192.168.77.77.51390: UDP, length 54
20:18:15.712774 IP 192.168.77.77.51390 > server.clickmeeting.com.27724: UDP, length 138
20:18:15.715210 IP 192.168.77.77.55330 > server.clickmeeting.com.23486: UDP, length 286
20:18:15.738042 IP 192.168.77.77.55330 > server.clickmeeting.com.23486: UDP, length 454
20:18:15.745556 IP 192.168.77.77.51390 > server.clickmeeting.com.27724: UDP, length 1085
20:18:15.755519 IP 192.168.77.77.55330 > server.clickmeeting.com.23486: UDP, length 1019
20:18:15.756502 IP 192.168.77.77.51390 > server.clickmeeting.com.27724: UDP, length 1085
20:18:15.767505 IP 192.168.77.77.51390 > server.clickmeeting.com.27724: UDP, length 1085
20:18:15.771929 IP 192.168.77.77.55330 > server.clickmeeting.com.23486: UDP, length 1020
20:18:15.772808 IP 192.168.77.77.51390 > server.clickmeeting.com.27724: UDP, length 138
20:18:15.777330 IP 192.168.77.77.55330 > server.clickmeeting.com.23486: UDP, length 306
20:18:15.778258 IP 192.168.77.77.51390 > server.clickmeeting.com.27724: UDP, length 1085
20:18:15.794847 IP 192.168.77.77.51390 > server.clickmeeting.com.27724: UDP, length 928
20:18:15.800226 IP 192.168.77.77.51390 > server.clickmeeting.com.27724: UDP, length 928
20:18:15.811043 IP 192.168.77.77.51390 > server.clickmeeting.com.27724: UDP, length 928
20:18:15.821119 IP 192.168.77.77.55330 > server.clickmeeting.com.23486: UDP, length 70
20:18:15.826639 IP 192.168.77.77.55330 > server.clickmeeting.com.23486: UDP, length 1062
20:18:15.833028 IP 192.168.77.77.51390 > server.clickmeeting.com.27724: UDP, length 138
20:18:15.833029 IP 192.168.77.77.51390 > server.clickmeeting.com.27724: UDP, length 70
20:18:15.837439 IP 192.168.77.77.55330 > server.clickmeeting.com.23486: UDP, length 305
20:18:15.843788 IP 192.168.77.77.51390 > server.clickmeeting.com.27724: UDP, length 863
20:18:15.849180 IP 192.168.77.77.51390 > server.clickmeeting.com.27724: UDP, length 864
20:18:15.853750 IP 192.168.77.77.55330 > server.clickmeeting.com.23486: UDP, length 1062
20:18:15.859177 IP 192.168.77.77.55330 > server.clickmeeting.com.23486: UDP, length 22
20:18:15.860214 IP 192.168.77.77.51390 > server.clickmeeting.com.27724: UDP, length 864
20:18:15.875684 IP 192.168.77.77.55330 > server.clickmeeting.com.23486: UDP, length 687
20:18:15.886515 IP server.clickmeeting.com.23486 > 192.168.77.77.55330: UDP, length 50
20:18:15.887064 IP 192.168.77.77.55330 > server.clickmeeting.com.23486: UDP, length 688
20:18:15.887760 IP 192.168.77.77.51390 > server.clickmeeting.com.27724: UDP, length 138
20:18:15.897445 IP 192.168.77.77.55330 > server.clickmeeting.com.23486: UDP, length 294
20:18:15.898473 IP 192.168.77.77.51390 > server.clickmeeting.com.27724: UDP, length 1044
20:18:15.908424 IP 192.168.77.77.55330 > server.clickmeeting.com.23486: UDP, length 494
20:18:15.909324 IP 192.168.77.77.51390 > server.clickmeeting.com.27724: UDP, length 1044
20:18:15.911499 IP server.clickmeeting.com.27724 > 192.168.77.77.51390: UDP, length 54
20:18:15.920163 IP 192.168.77.77.51390 > server.clickmeeting.com.27724: UDP, length 1045
20:18:15.924694 IP 192.168.77.77.55330 > server.clickmeeting.com.23486: UDP, length 1086
20:18:15.942069 IP 192.168.77.77.51390 > server.clickmeeting.com.27724: UDP, length 1081
20:18:15.946613 IP 192.168.77.77.55330 > server.clickmeeting.com.23486: UDP, length 1087
20:18:15.953808 IP 192.168.77.77.51390 > server.clickmeeting.com.27724: UDP, length 138
20:18:15.953809 IP 192.168.77.77.51390 > server.clickmeeting.com.27724: UDP, length 1081
20:18:15.957302 IP 192.168.77.77.55330 > server.clickmeeting.com.23486: UDP, length 290
20:18:15.964907 IP 192.168.77.77.51390 > server.clickmeeting.com.27724: UDP, length 1082
20:18:15.995725 IP 192.168.77.77.55330 > server.clickmeeting.com.23486: UDP, length 1102
20:18:15.997717 IP 192.168.77.77.51390 > server.clickmeeting.com.27724: UDP, length 982
20:18:16.008511 IP 192.168.77.77.51390 > server.clickmeeting.com.27724: UDP, length 138
20:18:16.008512 IP 192.168.77.77.51390 > server.clickmeeting.com.27724: UDP, length 983
20:18:16.017405 IP 192.168.77.77.55330 > server.clickmeeting.com.23486: UDP, length 304
20:18:16.019277 IP 192.168.77.77.51390 > server.clickmeeting.com.27724: UDP, length 983
20:18:16.022886 IP 192.168.77.77.55330 > server.clickmeeting.com.23486: UDP, length 1102
20:18:16.044702 IP 192.168.77.77.55330 > server.clickmeeting.com.23486: UDP, length 708
20:18:16.046570 IP 192.168.77.77.51390 > server.clickmeeting.com.27724: UDP, length 993
20:18:16.055710 IP 192.168.77.77.55330 > server.clickmeeting.com.23486: UDP, length 708
20:18:16.057629 IP 192.168.77.77.51390 > server.clickmeeting.com.27724: UDP, length 993
20:18:16.068542 IP 192.168.77.77.51390 > server.clickmeeting.com.27724: UDP, length 138
20:18:16.068588 IP 192.168.77.77.51390 > server.clickmeeting.com.27724: UDP, length 994
20:18:16.071966 IP 192.168.77.77.55330 > server.clickmeeting.com.23486: UDP, length 513
20:18:16.077405 IP 192.168.77.77.55330 > server.clickmeeting.com.23486: UDP, length 312
20:18:16.086445 IP server.clickmeeting.com.23486 > 192.168.77.77.55330: UDP, length 50
20:18:16.094435 IP 192.168.77.77.55330 > server.clickmeeting.com.23486: UDP, length 1070
20:18:16.095845 IP 192.168.77.77.51390 > server.clickmeeting.com.27724: UDP, length 820
20:18:16.101278 IP 192.168.77.77.51390 > server.clickmeeting.com.27724: UDP, length 820
20:18:16.110786 IP 192.168.77.77.55330 > server.clickmeeting.com.23486: UDP, length 1070
20:18:16.111843 IP server.clickmeeting.com.27724 > 192.168.77.77.51390: UDP, length 54
20:18:16.112250 IP 192.168.77.77.51390 > server.clickmeeting.com.27724: UDP, length 821
20:18:16.128649 IP 192.168.77.77.51390 > server.clickmeeting.com.27724: UDP, length 138
20:18:16.133058 IP 192.168.77.77.55330 > server.clickmeeting.com.23486: UDP, length 268
20:18:16.150310 IP 192.168.77.77.51390 > server.clickmeeting.com.27724: UDP, length 1188
20:18:16.160369 IP 192.168.77.77.55330 > server.clickmeeting.com.23486: UDP, length 684
20:18:16.161404 IP 192.168.77.77.51390 > server.clickmeeting.com.27724: UDP, length 1189
20:18:16.171198 IP 192.168.77.77.55330 > server.clickmeeting.com.23486: UDP, length 684
20:18:16.188689 IP 192.168.77.77.51390 > server.clickmeeting.com.27724: UDP, length 138
20:18:16.190303 IP 192.168.77.77.55330 > server.clickmeeting.com.23486: UDP, length 22
20:18:16.193923 IP 192.168.77.77.55330 > server.clickmeeting.com.23486: UDP, length 300
20:18:16.199564 IP 192.168.77.77.51390 > server.clickmeeting.com.27724: UDP, length 890
20:18:16.200545 IP 192.168.77.77.55330 > server.clickmeeting.com.23486: UDP, length 1175
20:18:16.204918 IP 192.168.77.77.51390 > server.clickmeeting.com.27724: UDP, length 891
20:18:16.227307 IP 192.168.77.77.51390 > server.clickmeeting.com.27724: UDP, length 22
20:18:16.227676 IP 192.168.77.77.55330 > server.clickmeeting.com.23486: UDP, length 815

